question,answer,start_time,end_time
หากเวลาเรานั่งสมาธิแล้วเกิดมีอาการรู้สึกมีอะไรพันคออยู่แต่เราก็ยังหายใจสะดวกอยู่เพียงแต่รู้สึกถึงมีบางอย่างพันคอเราอยู่ในช่วงเวลาเรานั่งสมาธิฉะนั้นมันคืออย่างไรและเราต้องแก้อาการที่เกิดขึ้นอย่างไร,มันจะมีอยู่สองกรณี กรณีแรกก็คือเกิดจากกรรมบางประการที่แสดงออกผ่านกายสังขารให้เราได้รับทราบว่าเราเคยมีกรรมชนิดนี้ไว้มาก่อน กรณีที่สองอาจจะเกี่ยวโยงกับอนุมนุษย์บางจําพวกที่พยายามจะรบกวนหรือมีความเกี่ยวพันบางอย่างอยู่กับตัวเราซึ่งสองกรณีนี้ ถ้าเป็นเรื่องของกรรมแล้วก็ให้เข้าใจว่าถ้าเป็นกรรมของเรา เราก็จะยอมรับกรรมอันนั้นคือตั้งจิตอยู่ข้างในไว้ถ้าเป็นกรรมของเรา เราจะยอมรับกรรมอันนั้นแต่ถ้าหากเป็นการก่อกวนด้วยเนื่องจากความไม่หวังดีความประสงค์ร้ายจากดวงจิตดวงใจบางดวงแล้วก็สามารถอุทิศส่วนกุศลที่เกิดจากการนั่งสมาธิหรือเราทํามาหรือบุญกุศลใดๆก็ตามที่เราระลึกถึงได้ระลึกถึงบุญนั้นและอุทิศไปให้เขา ,01.12.31,01.13.54
พระสงฆ์ที่ไม่รับกิจนิมนต์เลยถือว่าผิดข้อปฏิบัติของพระสงฆ์ไหม,การไม่รับจิตนิมนต์เลย มันก็ไม่ได้ผิดอย่างเช่นพระอัญญาโกณฑัญญะสิ้นอาสวะกิเลสแล้วหลีกเลี่ยงอยู่ในป่าไม่รับกิจนิมนต์อีกเลย แล้วไปสอนใครด้วยมีลูกศิษย์อยู่คนเดียวคือพระคุณตามีบุตรซึ่งเป็นหลานของของท่านเองแล้วพระคุณตามีบุตรนี้ก็เป็นอาจารย์ของพระอานนท์ทําให้พระอานนท์ได้เข้าถึงความเป็นพระโสดาบัน พระอัญญาโกณฑัญญะนี้หลีกเล้นแต่อยู่ในป่าอย่างเดียวไม่รับกิจนิมนต์ที่ไหนเลยก็เป็นพระอรหันต์ ,01.13.56,01.14.45
ถ้าเป็นคนมีความจําที่ดีเกี่ยวกับเรื่องสัญญาขันธ์ไหม,การมีความจําที่ดีคือดีคือจำได้หมดทุกเรื่อง มันมีอยู่สองประการ หนึ่งคือสติดีระลึกรู้อะไรก็รวดเร็วจดจําได้ง่ายอันที่สองสัญญาขันธ์ทำหน้าที่อย่างแจ่มชัดไม่มีอะไรมารบกวน คือเรียกว่าแสดงว่าคนๆนี้จิตไม่ค่อยขุดมัว ถ้าจิตไม่ค่อยขุดมัว สัญญาขันธ์จะทำหน้าที่ได้ดีกลับมีสติระลึกรู้ดี สองประการนี้ทำให้เกิดการจดจําที่ดี,01.14.47,01.15.39
พระที่รับบิณฑบาตแต่ไม่เดินคือนั่งอยู่หน้าร้านค้าเพื่อรอรับบาทถือว่าผิดไหมเราใส่บาตรกับท่านได้ไหม,ก็ถือว่าไม่ผิดเพราะว่าเป็นความประสงค์ของท่านคือไม่ได้ผิดอะไรบางคนอยากจะรับบ้านใครก็ไปยืนอยู่ต่อหน้าเป็นเพียงแต่ว่าอย่าแสดงกิริยาอาการใดๆก็ตาม อันทําให้เขาเกิดการละเมิดพระวินัยออกมาเช่นออกปากขอโดยตรงอะไรประมาณนี้ ถ้ามีการนิมนต์ไปข้างหน้าเราก็ต้องไปข้างหน้า ซึ่งมันไม่ได้ผิดอะไร,01.15.42,01.16.37
กรรมของคนที่ไม่ดูแลรับผิดชอบบุตรจากสายเลือดตัวเองจะเป็นอย่างไร,พระพุทธเจ้าสอน บุคคลผู้เป็นบิดามารดาให้เลี้ยงดูบุตรอย่างดีให้มอบมรดกให้ ให้การศึกษา ให้หาสามีให้หาภรรยาให้สิ่งแรกคือหน้าที่ของบิดามารดานะ ทีนี้สำหรับบุคคลผู้ไม่ทำหน้าที่ของบิดามารดา จะได้รับผลของการทำเหมือนอย่างที่เราทำกับลูกอย่างเช่นไม่มีลูกให้คอยดูแลในตอนในตอนแก่เฒ่าแก่ชรา อาจจำเป็นต้องอยู่คู่เดียวอะไรประมาณนี่คือสิ่งที่เรียกว่า ผลตอบรับในปัจจุบันชาติแล้วทีนี้อนาคตจะเป็นยังไงจะเป็นบุคคลผู้ถูกทิ้งหรือถูกทิ้ง อย่างเช่นคลอดออกมาเขาก็ทิ้งไปเลยอย่างเช่นเกิดเป็นสัตว์เดรัจฉานเขาก็คลอดทิ้งไปเลย ไม่มีพ่อแม่เลี้ยงดูอะไรประมาณนี้จะเป็นวิบากกรรม,01.17.15,01.18.38
เราจําเป็นต้องท่องพุทโทเมนาโถไหมไม่ท่องได้ไหม ,สำหรับบุคคลพูดถึงกระแสพระรัตนตรัยมีพระรัตนตรัยแนบเนียนอยู่ในจิตไม่จำเป็นต้องท่องสำหรับบุคคลผู้ยังไม่ถึงพระรัตนตรัย จำเป็นต้องระลึกถึงพระรัตนตรัยอยู่เนืองๆ,01.18.43,01.19.35
เราอยู่ในสังคมอาจจะมีพลั้งเผลอพูดทั้งดีไม่ดี พูดเพ้อเจ้อ พูดทะลึ่งลามกสองแง่สองง่ามบ้าง ไปร่วมสนทนานินทาคนที่เราไม่ชอบบ้างหรือพูดถึงสิ่งที่เราไม่ได้ดั่งใจบ้าง พลั้งพูดคําหยาบบ้างเราควรสอนจิตอย่างไรไม่ให้เผลอ,ทางที่ดีที่สุดก็คือการตั้งเจตนาให้แรงกล้า ตั้งเจตนาให้แรงกล้าแบบเห็นโทษในการกล่าวออกไปให้มากที่สุด วาจาใดๆก็ตามที่เรากล่าวออกไปแล้วและเราเองก็รู้ด้วยว่ามันเป็นโทษการถามอย่างนี้แสดงว่าคนนั้นรู้ด้วยว่ามันเป็นโทษและเป็นสิ่งที่ไม่ดี วิธีการที่ดีที่สุดก็คือการตั้งเจตนาอย่างแรงกล้าที่จะไม่กล่าวออกไปเขาเรียกว่าหากห้ามใจตัวเอง หักข้ามแล้วหักข้ามอีก หักข้ามอยู่เรื่อยๆเพราะความคุ้นชินความเผลอตัวความเคยตัวที่เคยพูดอยู่เป็นประจำ เขาเรียกว่าอาจิณณกรรมกรรมที่เป็นความเคยชิน กรรมที่ทำเป็นอาจิณ ตอนแรกเราอาจจะใช้กรรมทางวจีกรรมนี้ด้วยความพลั้งเผลออยู่บ่อยๆแต่บ่อยมากเข้ามากเข้าอาจิณณกรรมที่ทำเราอยู่บ่อยๆมันจะกลับมาควบคุมเรา เมื่ออาจิณณกรรมกลับมาควบคุมเราเมื่อได้เมื่อไหร่เมื่อนั้นเราจะถูกกรรมนําไปสู่วิบากที่จะได้รับผลในภายภาคหน้าซึ่งมันจะอันตรายมากแล้วเราจะแก้ไขได้ยากฉะนั้นวิธีการแก้ไขคือต้องใช้เจตนาอย่างแรงกล้าที่จะงดเว้นในการที่จะไม่กล่าวเผลอออกไปหรือพูดพลาดพูดด้วยความประมาทพูดด้วยความเผลอเรอพูดด้วยความที่คึกคะนองทางใจต้องฝึกตัวให้ดีวิธีที่ดีที่สุดที่จะช่วยก็คือการระลึกถึงพระรัตนตรัยจะช่วยได้มากเลย,01.19.37,01.21.34
ถ้าในกรณีที่มีคนมาทำไม่ดีกับเรา เราแผ่เมตตาให้กับเขาแล้วแต่เราไม่จำเป็นต้องไปพูดไปคบกับเขาได้ไหมคือแบบต่างคนต่างอยู่ไปเลย ,ได้แน่นอน เราไม่คบกับเขาก็ได้เพราะพระองค์ก็ตรัสไว้ชัดเจนแล้วว่า อะเสวะนา จะ พาลานังปัณฑิตานัญจะ เสวะนา การไม่คบคนพาลก็เป็นมงคล การคบหาบัณฑิตถึงจะเป็นมงคล การไปคบคนในบางคนในสังคมเราไม่จําเป็นจะต้องไปคบใครในสังคมทุกคนที่เรารับรู้รับทราบได้เห็นกันอยู่เราสามารถที่จะเลือกได้ การเลือกคบคนก็จัดอยู่ในศาสตร์พุทธศาสตร์บัญญัติน ศัพท์โพธิสัตว์ธรรมก็ได้ ธรรมที่ของสัปบุรุษคือรู้เหตุ รู้ผล รู้ตน รู้การ รู้ประมาณ รู้บริษัท แล้วก็รู้บุคคล คําว่ารู้บุคคลคือรู้ว่าบุคคลไหนควรคบไม่ควรคบ,01.21.36,01.22.25
หากบิดาดูแลลูกให้การศึกษาให้เงินแต่ทางจิตใจไม่มีเวลาให้เลยอย่างนี้เขาบาปไหม,มันไม่บาปหรอก เขาให้เงินเราดีแล้วอย่าไปคิดว่าเป็นบาปน บิดามารดาอย่าไปมองว่าท่านกระทำบาป ท่านอาจจะไม่มีเวลา เราต้องเข้าใจ สังคมยุคนี้เราอย่าไปมองเรื่องของมารดาบิดาที่ไม่มีเวลาให้กับเรา อย่างหมอชีวกแม่ก็ไม่มีบิดาก็เป็นคนอื่นที่เขาเอาไปเลี้ยงเก็บไปเลี้ยงแต่หมอชีวกก็ตระหนักรู้ว่า แม้จะถูกเลี้ยงโดยกษัตริย์เองก็ตามจะอยู่อย่างนี้ไปตลอดชีวิตก็ไม่มีวันอับจนแต่ประโยชน์อะไรการในการอยู่โดยที่ตัวเองไม่สามารถสร้างประโยชน์อะไรกับใครได้อยู่ไปอย่างนี้มันก็ไร้ประโยชน์ เราแสวงหาความรู้ดีกว่าเพราะการแสวงหาความรู้จะมีคุณค่าอยู่ในใบตนเองเพราะการได้ทำประโยชน์จากความรู้ที่เรามีมันจะเกิดคุณค่ามากก็เลยไปเรียนเป็นหมอชีวกเป็นแพทย์ ฉะนั้นบิดามารดาจะมีเวลาให้หรือไม่มีเวลาให้ไม่ได้เป็นปัญหาอะไรเลย อยู่ที่เราเองที่เราจะจัดการกับชีวิตเราอย่างไรอย่าเรียกร้องให้ท่านมาคอยเอาอกเอาใจดูแลเรา เราก็เติบโตไปตามวิถีของเราไป,01.22.28,01.23.46
กรรมมีความหมายว่าอย่างไร,กรรมมีความหมายความว่าการกระทำ แล้วการกระทำแบ่งเป็นสามคือการกระทำทางกาย การกระทำวาจาและการกระทำทางใจ แล้วระบบของกรรมนี้ระบุไว้ชัดเจนว่ากรรมที่ใครก็ตามกระทำไว้แล้วจะได้รับกรรมนั้น แน่นอน รายละเอียดของกรรมมันเป็นสิ่งที่อยู่เหนือวิสัยที่คนจะสามารถเข้าใจได้แต่ถ้าใครสังเกตดีๆกรรมทุกชนิดไม่ว่าจะเป็นอดีตชาติเราตามไปสังเกตไม่ได้ แต่กรรมในปัจจุบันตามสังเกตดีๆพระอาจารย์เคยตามสังเกตแล้วสิ่งที่เกิดขึ้นกับตัวพระอาจารย์เองล้วนแล้วแต่เป็นสิ่งที่พระอาจารย์เคยทำมาทั้งนั้น ทั้งดีและไม่ดีในสมัยที่เป็นฆราวาสตั้งแต่จะเป็นเด็กจำความได้จนปัจจุบัน รู้เลยว่ารายละเอียดของกรรมส่งผลมาอันนี้เราเคยทำมันจะนึกได้เอง เราเคยเป็นอันนี้เราเคยทำอันนี้เราเคยอันนี้อย่างนี้มันจะมารายละเอียดของกรรมให้ผลไม่มีทางผิดพลาด ไม่มีทางผิดเพี้ยนตรงกับเรื่องราวตรงกับเนื้อหาตรงกับสิ่งที่เราเคยทำมาทั้งหมดเราจะลืมกรรมก็ตาม แต่กรรมไม่เคยลืมเรา,01.24.10,01.25.18
พึงเที่ยวไปผู้เดียวเหมือนนอแรดหมายความว่าอย่างไร,เมื่อเราไปกับผู้ใดแล้ว ไม่สามารถเป็นคนดีได้ พูดง่ายๆคือไม่สามารถเจริญกุศลขึ้นต่อไปได้ เขาไม่สามารถแนะนํากุศลได้ ก็พึงเที่ยวไปแต่ผู้เดียว พื้นฐานก็คือถ้าหากไม่สามารถดีกับใครได้ ไปคนเดียวอาจจะดีกว่า ถามว่าเพราะอะไร โดยปกติเราควรแนะนํากันให้ดีใช่ไหม คือควรชักชวนกันให้เป็นคนดียิ่งยิ่งขึ้นไป แต่ถ้าหากเราคบหรือว่าไปกับบุคคลที่แนะนําเราไปในทางที่ไม่ดี พระพุทธเจ้าคงกล่าวว่าให้ไปแต่เพียงผู้เดียว คือเดินไปแต่เพียงผู้เดียว อย่างเช่นมักมีโอกาส สำหรับบุคคลผู้แนะนํามรรคให้เราได้ มีโอกาสก็ควรกลับไปกับคนนั้น แต่ถ้าหากไม่มีบุคคลผู้แนะนําเราได้ก็พึงไปแต่เพียงผู้เดียว,01.25.21,01.28.36
