question,answer,start_time,end_time
แต่ก่อนเคยนั่งสมาธิได้สม่ำเสมอแต่ช่วงนี้นั่งไม่ได้ นั่งแล้วซึมตลอดพอไม่ได้นั่งก็เริ่มจะขี้เกียจนั่งและนั่งแล้วทำยังไงให้ก้าวข้ามเวทนาได้เพราะมันเจ็บขา,สมาธิไม่ได้เกิดจากการนั่งเสมอไป พระองค์ตรัสสรรเสริญสมาธิที่เกิดจากการเดินด้วยซ้ำ บุคคลผู้เดินจงกรม พระองค์บอกว่าสมาธิของบุคคลผู้เดินจงกรมนั้นจะเป็นสมาธิที่ตั้งมั่น ไม่เสื่อมง่าย ฉะนั้นสมาธิจริงๆไม่ได้เกิดจากการนั่งอย่างที่เราเข้าใจ ที่เราเข้าใจก็การนั่งด้วยแล้วก็การอิริยาบถอื่นเราก็ควรจะฝึกไม่อย่างงั้น เราก็จํากัดอยู่เพียงแค่การนั่งเท่านั้นถึงจะเกิดสมาธิอิริยาบถอื่นเราทำไม่ได้มันก็เป็นการทำให้เรามีข้อจํากัดที่ผูกมัดตัวเอง จะต้องอยู่กับท่านั่งในการทำสมาธิ การเดินจงกรมก็เป็นส่วนหนึ่งปวดขาก็ลุกไปนั่งง่ายๆแค่นี้ไม่ได้มีอะไรซับซ้อน,00.22.07,00.23.14
ถ้าเวรกรรมตามเราทัน ณ ตอนนี้เราควรทำอย่างไรดี,ถ้าตามทันจริงๆก็ต้องยอมรับเพราะกรรมนั้นจะได้เป็นอโหสิกรรมแต่ถ้าไม่ยอมรับ กรรมเกิดไม่เกิดเป็นอโหสิกรรมเมื่อกรรมไม่เกิดเป็นอโหสิกรรมคือกรรมจะไม่ให้ผลสำเร็จกรรมนั้นก็จะวนเวียนอยู่กับเราแล้วก็คอย บีบคั้นและก่อกวนเราติดตามเราอยู่ตลอดเวลาเพราะเขาติดตามให้ผลเพื่อให้เราเกิดการยอมรับผลแห่งกรรมนั้น เมื่อยอมรับแล้วมันก็ผ่านพ้นไปเสร็จสิ้นไปในแต่ละครั้ง ประดุจดังแพะตัวหนึ่งที่เขาจะจับไปสู่หลักประหาร แพะตัวนี้ดีใจเลยว่ามันเป็นวาระสุดท้ายและเป็นกรรมของเราที่เราจะได้รับยินดีเลยที่จะได้รับกรรมอันนี้เพราะเราจะพ้นจากกรรมที่เราเคยทำมาเมื่อห้าร้อยชาติก่อนนี้เคยเป็นนายพราหมณ์ที่ข้าแพะบูชายัญมาก่อน ตัวเองก็เลยเกิดเป็นแพะแล้วถูกนําไปสู่หลักประหารเพื่อทำการบูชายัญ ดีใจว่าตัวเองจะได้ถูกประหารเป็นวาระสุดท้าย คือชาติสุดท้ายเราจะได้พ้นจากพบของแพะจะได้พ้นจากกรรมสักที,00.23.39,00.24.55
หากมีบุคคลอื่นมาล้วงข้อมูลในโทรศัพท์เราโดยที่เราไม่ได้อนุญาตนี้นับว่าเป็นการลักขโมยไหมแล้วจะบาปหรือไม่,หลักการลักขโมยเขาตัดสินกันอยู่ดีคําว่าไถยจิต ไถยจิตนี่คือจิตคิดที่จะขโมยตรงๆโดยตรง แล้วก็เจ้าตัวก็ไม่อนุญาตอันนี้ก็แน่นอนอยู่แล้วก็ว่าด้วยเรื่องพ.ร.บ คอมพิวเตอร์ก็กําหนดโทษไว้ชัดเจนว่ายังไงก็มีโทษอยู่แล้ว,00.24.59,00.25.35
หากเรามีปณิธานจะฝึกปฏิบัติเพื่อมุ่งสู่หนทางแห่งการหลุดพ้นอย่างน้อยขอให้ถึงขั้นโสดาบันในชาตินี้เราสามารถประกอบอาชีพนักแสดงได้ไหมอาชีพนักแสดงถือว่าเป็นการสร้างบาปหรือไม่ ทําให้เส้นทางธรรมที่เราปรารถนาเนิ่นช้าลงด้วยไหมเนื่องจากยังมีภาระหน้าที่ในทางโลกอยู่อยากทํางานที่ตัวเองรักและมีความสุขสมดุลกับการฝึกปฏิบัติใช้ชีวิต ตั้งใจว่าสักประมาณห้าสิบปี รักษาศีลแปดให้เวลาปฏิบัติอย่างเต็มที่ตอนนี้ยี่สิบเจ็ดระหว่างนี้ก็ค่อยๆฝึกค่อยๆสั่งสมไปเรื่อยๆเมื่อเหตุปัจจัยพร้อมก็จะไปบวชเป้าหมายแบบนี้ได้ไหม,ได้วางเป้าหมายได้ อาชีพนักแสดงคืออยากจะบอกว่าอาชีพทุกอาชีพมีบาปอยู่ในตัวอยู่แล้ว พระก็มีบาปแต่มันมีวิธีการแก้ในความเป็นบาปในแต่ละอันแต่ละอัน สิ่งที่เราเลือกในการที่จะใช้ในการดำเนินชีวิตโดยเฉพาะอาชีพที่เรารัก เราก็ต้องยอมรับว่าบาปมันสามารถเกิดขึ้นได้ในการทำอาชีพแต่ละอาชีพ ไม่มีอาชีพไหนเลยที่ไม่มีบาป แต่จะมีแบบมาก แบบน้อย แบบปานกลางปะปนกันไป ซึ่งมันไม่ได้ถือว่าเป็นปัญหาอะไรมาก บาปทุกอย่างมันเกิดขึ้นได้ มันก็แก้ไขได้ไม่ใช่ว่าแก้ไขไม่ได้ นอกจากบาปอันหนักที่แก้ไขไม่ได้เลยก็คืออนันตริยกรรมอันนั้นจะต้องรับผลถ่ายเดียวเลยในเบื้องหน้า ฉะนั้นเรามีความตั้งใจที่ดีในการที่จะเข้ามาสู่การประพฤติปฏิบัติธรรม แม้เรายังจะใช้อาชีพนี้เลี้ยงชีพอยู่ก็ไม่ได้เป็นปัญหาอะไรในภายหลังเราสามารถมาประพฤติปฏิบัติธรรมได้ตามความตั้งใจ,00.25.37,00.27.22
พระอรหันต์หมายถึงอะไร,พระอรหันต์มีความหมายอยู่สามความหมาย ความหมายแรกก็คือผู้สิ้นอาสวะกิเลส ความหมายที่สองก็คือผู้จะต้องเข้าสู่พระนิพพานเป็นชาติสุดท้าย ความหมายที่สามก็คือผู้ไม่หมุนกลับ คือสิ้นสุดแห่งการเดินทางของชีวิตทั้งหมดแล้ว อรหันต์ก็คือไม่หมุนกลับมาอีก ,00.27.24,00.28.08
ว่าอยู่ดีๆเรารู้สึกนึกถึงกระวนกระวายนึกถึงคนๆหนึ่งเป็นเพราะอะไร,มันอาจจะไม่ใช่ มันต้องมีอะไรบางอย่างเกี่ยวกับตัวเรากับสิ่งที่เรานึกถึงอยู่นั้น ถ้าไม่มีเหตุปัจจัยด้วยกันมาก่อน มันอยู่ดีๆมันนึกถึงไม่ได้ มันจะต้องมีเขตปัจจัยด้วยแล้วจิตเราก็รับรู้รับทราบเรื่องราวเกี่ยวโยงกับผู้นั้นมาแล้วสิ่งนั้นมันถูกเก็บไว้ในภายในแล้วสิ่งที่ถูกเก็บไว้ในภายในนั้นแสดงอาการออกมาซึ่งอาตมาเรียกว่าสิ่งที่อยู่นอกเจตนาสิ่งที่อยู่นอกเจตนานี้ไม่อยู่ภายใต้การควบคุมบังคับของใครเขาอยากจะแสดงออก เขาอยากจะปรากฏ เขาอยากจะผุดขึ้นก็ตามปกติตามธรรมดาของขันธ์ที่เขาจะแสดงได้ฉะนั้นขอให้เข้าใจตามความเป็นจริง แม้เราไม่อยากจะนึกถึงมันก็สามารถนึกไปเองโดยระบบของอุปทานขันธ์อันนี้เขาเรียกว่าอุปทานขันธ์ที่มันมีอยู่ในตัวเราเองเขาเรียกว่าระบบการยึดโยงของขันธ์ที่ยึดถือกันอยู่การยึดโยงของขันธ์ที่ยึดถือกันอยู่ไม่ได้เกี่ยวกับเรา เราจะยึดก็ตามเราไม่ยึดก็ตามระบบของขันธ์มีการยึดกันอยู่แล้วเช่นตามองเห็น หูได้ยินเสียงจมูกดมกลิ่นลิ้นรส กลายรักการสัมผัส กายรับอารมณ์ เหล่านี้เป็นระบบของ ขันธ์ทั้งนั้นระบบของอุปทานขันธ์ ที่เขายึดโยงกันอยู่เมื่อตาเห็นแล้วเราเข้าไปมีอุปทานในสิ่งที่เห็น อันนี้เป็นอุปทานจากเราไม่เกี่ยวกับอุปทานของขันธ์ฉะนั้นถ้าเรารู้จักขันธ์ตามความเป็นจริงอุปทานจะหายไประบบที่เกิดขึ้นในตัวเราอย่างที่กล่าวถึงนี้เป็นระบบเหนือเจตนาซึ่งเป็นระบบของอุปทานขันธ์เป็นส่วนหนึ่งของชีวิตเราซึ่งมีอยู่ในตัวเราจะทำหน้าที่อยู่นอกเจตนาไม่ทำหน้าที่อยู่ภายใต้เจตนาแต่เมื่อเขาปรากฏขึ้นมาแล้วถ้าเราไม่เข้าใจเราจะไปเจตนาต่อต่อสิ่งนั้นด้วยความไม่รู้พอมีความไม่รู้เข้าไปกระทำต่อ มันจะเป็นระบบอุปทานจากเราเข้าไปยึด แม้กระทั่งว่าเราทําไมคิดเรื่องราวเหล่านี้ขึ้นมาได้ก็คือมันยึดเข้าไปแล้วในขณะนั้นโดยที่เราไม่รู้ตัวว่าเรากําลังยึดอยู่ ยึดด้วยความไม่รู้,00.28.14,00.34.07
เป้าหมายชีวิตคือการเข้าถึงพระธรรมให้ได้มากที่สุดทุกวันนี้ใส่บาตรทุกวันฟังธรรมทุกวันสวดมนต์นั่งสมาธิก่อนนอนแต่เรื่องที่ยากคือการภาวนาควรจะเริ่มยังไงดี,เริ่มต้นที่ดีที่สุดคือการศึกษา เรียนรู้ทำความเข้าใจ ซึ่งอาตมาอยากแนะนําว่าสิ่งที่เราทำอยู่แล้วถูกต้องอยู่แล้วในระดับหนึ่ง เป็นเพียงแต่ว่าเราอย่าพึ่งหมายเอาว่าสิ่งเหล่านั้นคือสิ่งที่ถูกต้องตามการเชื่อตามตามกันมา พูดง่ายๆ อะไรควรเชื่ออะไรไม่ควรเชื่อมันเป็นสิ่งที่เกิดจากความรู้ความเข้าใจของเรา สิ่งที่จะต้องเริ่มต้นอันดับแรกในการภาวนาคือการศึกษาเรียนรู้ความทำความเข้าใจเกี่ยวกับการภาวนาก่อนอย่าเพิ่งเริ่มต้นภาวนาคืออย่าเพิ่งเริ่มนั่งสมาธิอย่าเพิ่งเริ่มอะไรทั้งนั้นแต่ทำความเข้าใจให้ได้เข้าใจก่อนพอเราเข้าใจแล้วถึงจะสามารถเริ่มได้ถูกต้อง แต่ถ้าเรายังไม่เข้าใจ จับมาปฏิบัติเลยมันจะเป็นการผิดตั้งแต่ข้อแรกแล้วเราก็แก้ไขความผิดจนเราไม่สามารถดำเนินต่อไปได้อย่างถูกต้องเพราะฉะนั้นการเรียนรู้ทำความเข้าใจก่อนเป็นสิ่งที่สำคัญที่สุด,00.34.17,00.35.54
อารมณ์ความกลัวกับอารมณ์ความโลภในการลงทุนเราควรจะจัดการกับอารมณ์เหล่านี้อย่างไร,เรื่องนี้เป็นเรื่องของความรู้ ถ้าเรามีความรู้เพียงพอ ความกลัวมันจะไม่เกิดขึ้นหรือเกิดขึ้นมันก็ไม่ได้รบกวนการตัดสินใจในการที่เราจะทำหลายอย่างในหลายสิ่งที่เราตัดสินใจในการที่จะกระทำสิ่งใดสิ่งหนึ่งแล้วเราเกิดความกลัวขึ้นมานั่นคือเรามีความรู้ในเรื่องนั้นไม่พอ ถ้าเรามีความรู้ในเรื่องนั้นพอมันจะไม่มีปัญหาอะไร แล้วถ้าใครอยู่ในการทำอาชีพที่เรียกว่าลงทุนอยู่บ่อยครั้ง เขาจะไม่กลัวเรื่องพวกนี้ทุกอย่างมันก็มีผลประกอบผลที่เกิดขึ้นอยู่สองอย่างคือได้กับไม่ได้มันมีอยู่แค่นี้ การลงทุนมันก็เสี่ยงเสมอไม่ว่าจะอะไรทั้งสิ้น การสร้างความรู้เป็นสิ่งที่ดีมากและไม่เสี่ยงความรู้เป็นสิ่งที่จะทำให้เราเกิดความมั่นใจต่อการลงทุนทุกเรื่อง,00.36.36,00.37.50
