question,answer,start_time,end_time
ก็คือมีได้ แต่ต้องระลึกให้ถูก ,ใช่ ระลึกให้ถูก อย่ายึดเกาะอยู่กับลูกเคารพนั้น ถ้าการยึดเกาะลูกเคารพนั้น เกิด จิตยึดเกาะไว้อันตราย เพราะอะไร เพราะพระองค์ตรัสไว้ว่า ขนาดพระองค์ยังทรงพระชนอยู่ วักกลีติดตามกราบไหว้รูปกายของพระองค์ ว่ารูปกายของพระองค์เป็นรูปที่น่าเลื่อมใส น่าเคารพน่ากราบไหว้ บวชมาเพื่อสิ่งเดียวคือขอไหว้สักการะ เพราะความเลื่อมใส ผูกติดพัวพันในจิตในรูปสักการะของพุทโธ ไม่เคยเจอภาวะบุคคลผู้มีรูปกายอันบริบูรณ์สมบูรณ์ด้วยอินทรีย์ที่เพียบพร้อมสมส่วนในตัวบุคคล เกิดมาไม่เคยเห็น พอเห็นก็ยอมบวชอุทิศเพื่อการติดตามกราบไหว้ พระองค์บอกว่า ผู้ใดเห็นธรรมผู้นั้นจึงเห็นเรา แม้เห็นเราตัวเนื้อตัวหนัง ก็ได้ชื่อว่าไม่เห็น พระองค์ก็เลยบอกว่า วักกลิเธอจะติดตามกราบไหว้รูป ร่างกายอันเปื่อยเน่าของตถาคตนี้ทําไม กราบไหว้รูปร่างกายอันเปื่อยนอกของตถาคตนี้ทําไม คําถามคือทําไม ก็คือพระองค์ไม่มองเห็นประโยชน์ในการกราบไหว้อันนั้น แล้วพระองค์ก็เล็งดูด้วยว่าใครก็ตาม กราบไหว้ด้วยการยึดเกาะรูปร่างกายของพระองค์นั้น ย่อมได้คติสองอย่างคือ กําเนิดสัตว์เดรัจฉานกับเปรตผีปีศาจอย่างใดอย่างหนึ่ง,00.52.14,00.53.39
คือเหมือนเขากราบไหว้ด้วยความที่รู้แบบนี้ ,ก็ ได้ผลคือความไม่รู้ไปในทุคติอันนั้นด้วย ไม่ร้ายแรงเป็นวงจรของบุคคลผู้หลงผิด ก็เป็นอย่างนี้แหละ ก็อยู่ในวัฏฏะนี้ต่อไป สืบต่อไปอีกยาวนาน เพราะไม่ยอมศึกษาคําสอนของพระพุทธเจ้า คําสอนของพระพุทธเจ้าเป็นความรู้อยู่แล้ว ไม่แสวงหาความรู้ก็ตกอยู่ภายใต้ความงมงายมันก็แค่นี้ ไม่อยู่ในฝ่ายสว่าง ก็จะอยู่ในฝ่ายของความมืด ชีวิตเรามันขึ้นอยู่กับว่าเราจะเลือกในข้างของเหตุผลหรือไม่ หรือไม่ยอมฟังเหตุผลจะเอาแต่ความเชื่อ จะเอาแต่สิ่งที่ตัวเองคิดว่าใช่แล้วถูกต้อง ก็แล้วแต่ ทุกคนรับผิดชอบตัวเองอยู่แล้ว ในสิ่งที่ทํา คําที่คิด คําพูดที่พูด สิ่งที่คิด สิ่งที่กระทําอะไรทั้งหมด  มันตกเป็นผลนําสืบตัวเองไปในเรื่องราวนั้นๆอยู่แล้ว พุทธรูปมาตอนไหน มาช่วงปีไหน หลังพุทธกาลแปดร้อยปี หลังพุทธกาลในยุคของ พระเจ้ามิลินทะหรือพระเจ้าเมนันเดอร์ กษัตริย์กรีก กรีกเขาถือการเคารพเทวรูปอยู่แล้วเป็นพื้นฐานในประเทศของเขา เขาเรียกเป็นอัธยาศัยของคนในประเทศของเขาอยู่แล้ว เขายึดถือเทวรูป เทพเจ้าเอเทนน่า เทพเจ้าซีอุดเป็นประจําทะเล เขาก็ยึดถือเขาจะมีเทวรูปใหญ่ๆพอพระเจ้าแมนเดอร์มานับถือพระพุทธศาสนา ก็คิดว่าอยากจะรู้ว่าพุทธสรีระของพระองค์ มีรูปลักษณ์อย่างไร ก็สั่งให้ช่างปั้นขึ้นมา เขาปั้นเพื่อมันเป็นสัญลักษณ์เพราะเขาอยากจะรู้ว่ารูปลักษณ์ของพระองค์เป็นอย่างไร เขาเปิดพระไตรปิฎกนั่นแหละ ปั้นออกมา แต่จะปั้นยังไงก็ตามก็เป็นการปั้นแบบกรีก คือสัดส่วนอะไรก็ตามจะออกลักษณะกรีกคือใหญ่ๆโตๆแบบเทวรูปอย่างนี้คือเขาจัดอยู่ในเป็นกลุ่มเทวะอันหนึ่ง กษัตริย์กรีกสร้างขึ้น ทีนี้พอถูกสร้างขึ้นมาก็ตามกันไปหมดตามคนฝรั่ง,00.53.44,00.55.59
เพิ่งท่องธาตุได้ประมาณสิบวัน พอท่องต่อเนื่องไปนานๆ ก็ท่องเร็วขึ้น ๆเหมือนท่องไปงั้นๆ ตามความคุ้นชินเจ้าค่ะ ต้องปรับแก้อย่างไรไหมเจ้าคะและขอพระอาจารย์กรุณาอธิบายคําว่ามันข้นเปลวมัน ของธาตุน้ําด้วยเจ้าค่ะ โยมไม่มั่นใจทําแปลในอินเทอร์เน็ตกลัวเข้าใจผิดค่ะ,มันข้น ถ้าท่องธาตุเร็วนะ แต่เร็วนั้นต้องฟังนะว่า เวลาเราท่องเร็วๆ เร็วแล้วมันเกิดการเร็วโดยทางใจเอง หรือเราเป็นผู้ยังมีเจตนาในการให้มันท่องอยู่ ยังมีเจตนาควบคุมบังคับให้จิตท่องอยู่ หรือจิตมันท่องเอง คําว่าเร็ว ถ้าจิตท่องเองได้แล้วนั้นให้ขยับไปสู่การพิจารณาได้ แต่ถ้าเป็นการยังบังคับให้ตัวเองท่องอยู่ ยังมีความรู้สึกว่าตัวเองท่องอยู่ ให้ท่องช้าลง แต่ถ้าจิตมันท่องเองแล้วเป็นความเร็วของจิตเองนั้นก็ให้เข้าใจว่าจิตมันท่องจนขึ้นใจแล้ว เพราะฉะนั้นท่องขึ้นใจแล้ว ขยับไปสู่การ พิจารณาร่างกายหกขั้นตอน คําว่ามันข้นก็คือมันในสมองศรีษะเป็นมันข้น เปลวมัน ก็คือพวกมันเปลว เปลวมันกับมันเปลว คือเป็นมันที่เกิดจากเปลวร้อนของร่างกายที่มันเคลือบผิวออกมา ในเวลาที่เหงื่อออก มันเปลวหรือเปลวมัน,00.56.04,00.57.30
แล้วเวลาที่อาบน้ําแล้วเราเห็นที่มันออกมา ที่มันมันๆอันนั้นก็คือเปลวมันใช่ไหมคะ ,ก็เปลวมัน ,00.57.31,00.57.37
คือเหมือนตอนที่หนูท่องตอนช็อตแรกหนูมีความรู้สึกว่าหรือหนูจะไป search Google หมดเลยว่าแต่ละอันมันเป็นรูปร่างยังไง แต่หนูก็ยังไม่ดูแต่ว่าพอเราเริ่มท่องไปเรื่อยๆ มันเหมือนจิตมันจะเริ่มมี มันน่าจะเป็นประมาณนี้ขึ้นมา แบบตอนแรกไม่รู้ว่าม้ามันเป็นยังไง แต่ว่าก็เลยฝืนใจยังไม่เปิด Google แต่ว่าท่องไปเรื่อย ๆ ก็เหมือนจะมีความรู้สึกว่า มันน่าจะประมาณนี้อะไรอย่างนี้ ,"คือพระอาจารย์อยากจะแนะนําว่าเราท่องไปไม่จําเป็นต้องไปเห็นภาพมันก็ได้ แต่ให้เข้าใจว่าการท่อง นั้นจุดประสงค์ของการท่อง เพื่อให้จิตได้เข้าใจว่าองค์ประกอบของร่างกายคือสิ่งนี้ที่เรียกว่าดิน สิ่งนี้ที่เรียกว่าน้ํา สิ่งนี้ที่เรียกว่าไฟ สิ่งนี้ที่เรียกว่าลม ไม่จําเป็นต้องไปเห็นภาพสิ่งนั้นก็ได้ ไม่จําเป็นต้องไปเห็นตับก็ได้ ไม่จําเป็นจะต้องเห็นไตก็ได้ ไม่ต้องจําเป็นต้องไปเห็นไส้เห็นพุงเห็นอวัยวะข้างในก็ได้แต่ให้รู้ว่านั่นคือมันเป็นองค์ประกอบของกายว่ากายเรานั้นถูกประกอบมาจากสิ่งเหล่านี้ ดํารงอยู่ด้วยกันประกอบกันอยู่ ขาดสิ่งใดสิ่งหนึ่งไปก็ไม่ได้ ขาดลมหายใจเพียงอย่างเดียว ทุกอย่างก็อยู่ไม่ได้อีกพังทลายหรือแตกสลายไปหมดเลย จุดประสงค์ของพระอาจารย์คือให้พิจารณาเห็นธาตุ จะได้เข้าใจว่าสรุปแล้วมันมีแค่ดิน, น้ํา ไฟลม ฉะนั้นไม่จําเป็นต้องไปเห็นเปลวมัน เห็นมันข้น มันสมองศีรษะมันอะไรต่างๆ ไม่จําเป็นเลยไม่มีความจําเป็น ให้ท่องไว้ เพื่อทราบ องค์ประกอบของร่างกายให้จิตมันเข้าใจเท่านั้นเอง ",00.57.38,00.59.07
ขอพระอาจารย์เมตตาอธิบายการท่องธาตุกรรมฐานสี่ค่ะ ระหว่างท่องควรนึกตามคำไปด้วยไหมคะ เช่น ธาตุดินที่มีในใบนี้คือผมขนเล็บฟันก็ให้นึกไปด้วยว่า นั่นคือผมขนเล็บ เป็นธาตุดินใช่ไหมคะ ,นึกก็ได้ ไม่นึกก็ได้ ไม่ได้เป็นปัญหา ท่องก็คือท่อง ท่องไปตามธรรมดาที่ท่องนี่แหละ นึกก็ได้ ไม่นึกก็ได้ ถ้าต้องการให้สติอยู่กับตัวเองมากก็นึก เพื่อที่จะท่องแล้วใจมันลอยไปนั่นลอยไปนี่ก็ให้นึกก็ได้ แต่สติจะได้อยู่กับตัวเอง,00.59.11,00.59.44
กราบนมัสการพระอาจารย์ช่วยอธิบายกิเลสให้หน่อยครับ ตามความเข้าใจของผมคือความอยากได้อย่างมี ,ความอยากได้อยากมีไม่ใช่กิเลส มันเป็นอกุศล โลภะอย่างนี้เป็นชั้นของโลภะ โลภะไม่ใช่กิเลส แต่ถ้าใช้โลภะร่วมทุจริตอันนี้เป็นกิเลส เรามีโลภะได้โดยไม่ต้องร่วมทุจริต เป็นโลภะที่ดี ไม่ผิด ส่วนกิเลสคือเครื่องเศร้าหมองใจ เครื่องเศร้าหมองใจที่ จัดอยู่ในฝ่ายทุจริตทั้งหมด กายทุจริต วจีทุจริต มโนทุจริตมีความโลภ แล้วกล่าววจีทุจริต มีความโกรธและกล่าวว่าวจีทุจริต มีความหลงและกล่าววจีทุจริต มีความโลภแล้วกระทํากายทุจริต  มีความโกรธแล้วกระทํากายทุจริต มีความหลงแล้วกระทํากายทุจริต มีความโลภแล้วเกิดมโนทุจริต มีความโลภและมีความโกรธแล้วเกิดมโนทุจริต มีความหลงแล้วเกิดมโนทุจริต ทุจริตพวกนี้สร้างกิเลสขึ้น แต่ตัวโลภะโทสะโมหะไม่ใช่กิเลสเป็นอกุศลละมุน เป็นรากเหง้าของอกุศล กิเลสเป็นผลถูกไหม กิเลสเป็นผล จากการทําทุจริต เพราะคนส่วนใหญ่เข้าใจว่ากิเลสเป็นเหตุ ,00.59.47,01.01.16
พระอาจารย์คะแล้วคําว่ามโนทุจริตค่ะ มโนนั้นมันหมายถึงการที่เราเจตนาที่จะคิดทุจริต ,การจงใจอย่างแรงกล้าเพื่อที่จะกระทํา  จงใจดําริ จงใจตรึกนึก จงใจเพื่อจะให้เกิดความเป็นอย่างนั้น อย่างแรงกล้าเลยนี่คือมโนทุจริต ,01.01.22,01.01.42
แล้วถ้าสมมติว่าความคิดที่มันเหมือนจะเป็นการทุจริตที่มันเด้งขึ้นมา แต่เรารู้สึกว่า อันนี้ไม่ดีแล้วก็เราก็ไม่ได้ไปทำมัน,เราไม่ได้จงใจ การที่เราไม่ได้จงใจมันเป็นเพียงแค่สภาพของ อารัมมณะคือกลุ่มอารมณ์ทั้งหลาย ที่มันเคยมีการแฝงและระลึกติดอยู่กับพื้นเพจิตเดิมเก่าๆมันถูกแสดงออก โดยที่ไม่ได้ผ่านเจตนาของเรา แต่อาศัยจิตเราเกิด ทีนี้พวกนี้มันจะจัดอยู่ในกลุ่มอาสวะกลุ่มอนุสัย กลุ่มสังโยชน์ ถ้าเราแยกตัวนี้ไม่ออกนั้นคนส่วนมากแยก อาการเหล่านี้ไม่ออกในจิตตัวเอง เหมารวมเป็นกิเลสไปหมด มันก็คือปฏิบัติมั่ว มั่วอย่างนี้ไม่ได้ ศาสนาพุทธไม่มีมั่วศาสนาพุทธเป็นศาสนาแห่งความรู้ ทําด้วยความรู้ ทําด้วยตาที่มองเห็น สัมมาทิฏฐิคือมองเห็นก่อนว่าอันนี้อยู่ตรงนี้ อันนี้อยู่ตรงนี้ แล้วลงมือทํามัน ไม่ใช่หลับตาไม่รู้เรื่องหรอก เขาบอกให้ทําก็ทํา เขาบอกให้เดินก็เดิน เขาบอกให้นั่งก็นั่ง เขาให้ทําอะไรก็ทําไปหมด ทําด้วยสายตาที่มองเห็นคือสัมมาทิฏฐิอย่างถูกต้อง ไม่มั่ว มั่วไม่ได้ ,01.01.43,01.02.50
พระอาจารย์คะแล้วอย่างเรื่องมโนทุจริตนี้ค่ะ อันนี้ก็เป็นการนึกภาพใช่ไหมคะ แล้วถ้าเรานึกภาพ แล้วเหมือนนึกภาพเพื่อให้เกิดความเชื่อ เพราะเราต้องการในสิ่งนั้น แล้วพอเกิดความเชื่อมันจะไปเกิดเป็นการกระทํา แล้วก็ไปเกิดเป็นเหตุการณ์อย่างนี้ค่ะแบบนี้ถือว่าผิดไหมคะ,มันไม่ผิดในแง่ของทุจริต แต่มันผิดในแง่ของการไม่ตรงกับข้อเท็จจริงแห่งเหตุปัจจัย พระพุทธเจ้าเป็นผู้รู้เหตุแห่งการนํามาซึ่งผลที่จะให้ได้รับแบบนี้ หมายถึงว่าเราต้องการผลแบบไหนกําหนดเป้าหมายหรือผลอันนั้นเกิดขึ้น แล้วมองหาเหตุตามหลักการทางพระพุทธศาสนาว่าเหตุอะไรที่จะนําไปสู่ผลแบบนี้ แล้วทําเหตุอันนั้น เพื่อไต่เข้าไปหาผลอันนั้นเอง แต่ถ้าเราคาดการณ์เอง คิดเองหรือมีข้อมูลแทรกเข้ามาให้เราเชื่อว่าการทําแบบนี้อย่าได้ผลแบบนี้ อันนั้นก็คือถ้ามันตรงกับข้อเท็จจริงกทางพุทะศาสนา อันนั้นก็ยอมรับได้ แต่ถ้ามันไม่ตรงกับข้อเท็จจริง พระพุทธเจ้าไม่ยอมรับ พุทธศาสนาไม่ยอมรับ,01.02.52,01.04.05
 เหมือนกับว่าถ้าเรามีความรู้ความเชื่อจากทางอื่น เหมือนเราก็ต้องเอามาเทียบว่าสิ่งนี้คือคําพูดแต่ละอย่างนี้ จะแตกต่างกับพระพุทธศาสนาถูกไหมคะ แต่เหมือนบางอย่างอาจจะ แบบวิธีเหมือนกัน แต่เหมือนใช้คําสอนที่แตกต่างกันอย่างนี้ค่ะ เราก็เอามาเทียบว่าเป็นสิ่งเดียวกันหรือเปล่าแบบนี้ ,ใช่ มันลงรอยกันไหม ถ้าไม่ลงรอยกันก็ปฏิเสธได้เลย อย่าไปสงสัยลังเลคิดว่าแล้วก็ตั้งความเชื่อว่า สิ่งนั้นยังจะมีประโยชน์หรืออํานวยผลให้กับเราอยู่ดีอยู่ ต้องเข้าใจว่าฐานะชาวพุทธเราต้องเจริญตามหลักการทางพระพุทธศาสนาเราถึงจะได้ผลในศาสนาที่ถูกบอกไว้และสอนไว้ ผลอันนั้นก็จะอํานวยผลตามหลักการทางศาสนาไม่ผิดไปจากหลักการ พระพุทธเจ้าไม่ได้สอนใครให้ไปสู่ความล่มจมฉิบหายหรอก พระองค์สอนให้คนเขาถึงความเจริญทั้งนั้นแหละหลักการทางศาสนานี้แล้วเป็นหลักการแห่งข้อเท็จจริง คือความเป็นจริง ข้อเท็จก็สอนว่ามันเป็นเท็จ ข้อจริงก็สอนว่ามันเป็นจริง จริงหรือเท็จ เราเรียนรู้แล้ว เราก็นํามาสู่การสร้างประโยชน์ ในข้อปฏิบัตินั้นๆ ให้ถูกต้อง ,01.04.07,01.05.16
