question,answer,start_time,end_time
,"เขาเหล่านั้นอยู่ดํารงอยู่ในสถานะของผู้ชดใช้วิบากกรรมแล้วรอการอุทิศส่วนกุศลในสิ่งที่พวกเราสามารถทําได้ ส่งไปให้เขา 
เขาหวังผลบุญจากมนุษย์ แต่มนุษย์ไม่เคยรู้สถานะของตนเองว่า สถานะตัวเอง มีคุณค่าเพียงพอในการที่จะสร้างความดีและส่ง
ผลบุญอุทิศไปให้เขา มนุษย์เราไปตั้งค่าของการเคารพสักการะกราบไหว้เซ่นสรวงบูชา หลวงพ่ออยากกินอะไรก็เอาไปให้กิน 
เผื่อว่าวันที่สิบหกกับวันที่หนึ่งจะมีโชค ซึ่งมันเป็นความหวังแบบลมๆแล้งๆ แต่ขนาดนั้นเราก็ยังมีใจอยากจะให้มันได้อยู่ 
แล้วสิ่งเหล่านั้น แทนที่ว่าพุทธศาสนาในประเทศเรา มันเป็นศาสนาซึ่งไปเต็มไปด้วยเหตุผล ควรจะเป็นศาสนาที่เราจะต้องรู้และ
เข้าใจในเนื้อแท้ของศาสนา หรือตัวหลักคําสอน ให้มันถูกต้อง และปฏิบัติให้ตรงกับความเป็นจริง แต่เรากลับไม่ได้ทําอย่างนั้นเลย  
ถ้าเรารู้แล้วว่า เจ้าปู่ เจ้าตา เจ้าพ่อ เจ้าแม่ หรือ เทพเทวาทั้งหลาย สถิตย์อยู่ตามต้นไม้สถิตย์อยู่ที่ไหนๆก็ตาม หรือแม้แต่
พระภูมิเจ้าที่ เขาดํารงอยู่ด้วยการรอผลบุญจากเรา หน้าที่ของเราคือทําบุญอุทิศส่วนกุศลให้เขา พระพุทธเจ้ารู้เรื่องนี้ดี 
พระองค์จึงบอกว่า ปูชิตา ปูชะยันติ  มานิตา มานะยันตินังการบูชานี้คือการอุทิศส่วนกุศลให้กับเทวดา ไม่ใช่ไปจุดธูปจุดเทียน
กราบไหว้บูชา แต่คนพุทธเราก็ไม่ได้ตื่นรับรู้ในเรื่องพวกนี้ ก็ยังหลับไหลเพื่อที่จะทําแบบนั้น หลับหูหลับตาที่จะทําต่อไป โดย
ไม่สนใจหลักคําสอน เพราะความเชื่อ เชื่อว่าเทวดาจากดลบันดาลอะไรให้บางสิ่งบางอย่าง และหวังผลการตอบสนอง เพราะ
เวลาเหมือนกับว่าเรามาทําความดีด้วยตัวเอง เหมือนกับไม่เชื่อมั่นในความดีตัวเองทํา ว่ามันจะอํานวยคนและตอบสนอง 
หรืออาจจะมองว่า ทําดีแล้วมันให้ผลช้า เขาบอกทําดีแล้วมันได้ชาติหน้า กว่าจะได้มันได้ชาติหน้า มันอยากจะให้ชาตินี้ 
ก็คิดอย่างนี้ไง ก็เลยไม่เข้าใจว่า เราก็ต้องค่อยสั่งสมไป เพื่อความดีนั่น จะได้พอกพูนและเต็มเปี่ยมและรอการอํานวยผล
ให้กับเรา พระองค์ไม่เคยปฏิเสธการสะสม พระองค์ก็สะสมมาไม่ใช่น้อย สี่อสงไขยแสนกัป กว่าจะมาเป็นพุทธเจ้า แล้วเรา
บอกว่าจะขอเอาชาตินี้ เขาบอกว่าให้ตกนรกชาตินี้จะเอาไหม  เขาบอกไม่เอาอีก  อะไรก็อะไร ก็จะเอาแต่ชาตินี้ไง จะเอาแต่
อะไรก็ตามที่มันตอบสนองต่อความต้องการของตน ก็จะเอาอันนั้น แล้วไม่ฟังเหตุผล แล้วทําโดยที่มันเป็นความผิดโดยไม่รู้เนื้อ
รู้ตัวว่ามันจะมีความผิดและความเดือดร้อนตามมาในภายหลัง และเห็นแก่ผลประโยชน์ที่เกิดขึ้นกับต่อหน้า ท่านบอกจุดธูปสิบหกดอก  
สิบหกชั้น ห้าสิบห้าชั้นดิน ปรากฏว่าปรากฏว่าอีกวันรุ่งขึ้นได้ผลตอบสนอง ในสิ่งที่ตัวเองต้องการ เชื่อมั่นเลยว่าธูปสิบหกดอกนี่แหละ 
คือสิ่งที่กําหนดชะตาชีวิตของเขา ปักใจตรงนั้น ไม่มีเหตุผลแล้ว คําว่าทําดีได้ดี ทําชั่วได้ชั่ว จะไม่สามารถเป็นหลักการในจิตใจของเขาได้ 
เพราะเขาเชื่อเรื่องธูปไปแล้ว นี่คือการขาดความรู้ มันเลยมีสิ่งอื่นแทรกเข้ามา ที่เป็นกระแสของความงมงาย  แทรกเข้ามา 
ในพุทธศาสนาเรา เพราะความรู้มันไม่เข้มแข็ง มันไม่ทําให้คนเกิดความเข้าใจตามหลักการศาสนาจริงๆ มันเลยเกิดเป็นปัญหาอยู่ 
ก็เลยเป็นความจําเป็นที่พระอาจารย์ต้องได้พูดเรื่องนี้ เพื่อให้เกิดการตื่นรู้แล้วเป็นที่รับรู้ต่อคน  ก็ยังดีที่ว่ายังพอมีคนมี หูที่ประกอบ
ด้วยเหตุผลอยู่ ฟังแล้วยังพอเข้าหูเขาอยู่ เพราะบางรายฟังไม่เข้าหูเขาเลย ฟังกันจริง หูไม่มีเหตุไม่มีผล มีแต่หู กับขี้หู เหตุผลไม่มีเลย 
คือไม่รู้อะไรคือเหตุอะไรคือผล ก็ทําไปตามที่เคยทําความเชื่อค่านิยม ขนบธรรมเนียม แล้วให้อย่างอื่นมาเป็นเครื่องกําหนดชีวิตตัวเอง 
 ถ้าเราปล่อยให้ชีวิตเราถูกกําหนดด้วยสิ่งอื่น ก็เท่ากับว่า เราก็ใช้ชีวิตแบบล่องลอยไปตามยถากรรม พระองค์ไม่ต้องการให้ชีวิตมนุษย์
เป็นแบบนั้น เพราะมนุษย์จะมีทางพ้นทุกข์ได้เลย ถ้าปล่อยให้ชีวิตเป็นไปตามยถากรรมเหมือนกับโยนท่อนไม้ขึ้นไปบนอากาศ  
ไม่รู้ว่าทางหัวหรือทางท้ายจะตกก่อน  คือชีวิตเราไม่รู้เลยว่าจะไปตกทางดีหรือทางร้าย เพราะปล่อยไปตามเหตุปัจจัย หรือว่าอิทธิพล
ภายนอกซัดไป น้อมใจไป กระแสสังคมกําหนดทิศทางให้ทําอย่างนั้น พอทํากันไปก็จมก็จมไปด้วยกัน ก็เลยมีคนเขาบอกว่า ก็ดีมีเพื่อน
ไปอยู่ในนรกด้วยกัน ยังมีเพื่อนอยู่เขาว่า ไม่ได้ไปคนเดียวโดดๆ พระองค์ก็บอกแออัดเหมือนกับเมล็ดข้าวสารน่ะ อยู่ในนรกยังจะไป
แทรกอยู่ในสิ่งที่มันแออัด เมล็ดข้าวสารอยู่ในกระสอบ แออัดยังไง นรกมันแออัดไปอย่างงั้นด้วยจิตวิญญาณของบุคคลผู้ไม่อยู่ในหลัก
การที่ถูกต้อง ไม่มีสัมมาทิฐิ เมล็ดข้าวสารในกระสอบแออัดยังไงก็ตามนะ สัตว์นรกแบบเดียวกันทั้งนั้น เรายังจะไปเบียดอยู่ในกระสอบ
ข้าวสารแบบนั้นอยู่อีกเหรอ ต้องพยายามหาทางให้ตัวเองหนีใช่ไหม ออกจากสิ่งที่มันเป็นสิ่งที่มันไม่ชอบ ต้องพยายามหาทางหนี
 มันหนีวันนี้ไม่ได้ หนีเอาวันพรุ่งนี้ วันพรุ่งนี้หนีไม่ได้ วันต่อไปพยายามหาทางจะหนี ต่อไปหาทางหนีไม่ได้ ต่อไปอีกต้องหาทางหนี 
คิดที่จะหาทางหนี หาทางออก หาทางหลุดหาทางพ้นอยู่เรื่อยๆ คิดอยู่เรื่อยๆ อย่าคิดที่จะปล่อยให้ตัวเองจมปลักอยู่กับวิถีแห่ง
ความหลงความงมงาย ความไม่เข้าใจ ความไม่ถูกต้อง เพราะฉนั้นการกล่าวถึงความจริง เราก็ต้องพูดถึงตัวของเราเอง ซึ่งเป็น
ความจริงประจักษ์ อยู่กับตัวเรา ตั้งแต่ตื่นนอนจนถึงเข้านอน ตัวเราเองนี่แหละเป็นตัวพยาน เป็นประจักษ์ยืนยัน เป็นเหตุเป็นผล 
ว่าวันหนึ่งที่เรามีชีวิตอยู่ เรามีชีวิตอยู่ด้วยความสุขด้วยความทุกข์อย่างไร สุขหรือทุกข์มากน้อยกว่ากัน ดีหรือชั่วที่เข้ามาเกี่ยวข้อง
กับชีวิตของเราในแต่ละวัน ถูกหรือผิดที่เรากําลังกระทําอยู่ แฃ้วสิ่งเหล่านั้นน่ะจะเป็นเครื่องกําหนดชีวิตเรา ถ้ามีความโกรธในขณะ
นี้เราก็ทุกข์ขนาดนี้แล้ว ถ้ามีความไม่พอใจเราก็ทุกข์ ในขณะนี้ ที่มีความไม่พอใจ ถ้าเราดับความโกรธได้ในขณะนี้จิตใจก็เราก็เย็นเบา
สบายในขณะนี้ มันไม่ใช่เรื่องที่ลึกลับซับซ้อนอะไรเลยหลักธรรมะ มันเป็นความจริงที่อยู่ในตัวคน แล้วถ้าหากเราเข้าใจและรู้วิถีของ
ชีวิตที่เกิดดับเสื่อมสิ้นไปตามธรรมดาไม่ได้หลงเข้าไปยึดถือ กายสังขารและจิตอสังขารว่าเป็นของตน ด้วยกระบวนการแห่งการ
พิจารณาภายใน เราจะเข้าถึงภาวะความรู้อีกอันหนึ่ง ภาวะความรู้อันนี้มันเป็นอิสระทางใจ ภาวะที่ไม่ยึดเกาะยึดติดเกาะเกี่ยวอยู่
กับสิ่งใดทั้งปวง ทั้งดีและไม่ดี จิตจะไม่หวั่นไหวต่อโลกกระทัน ภาวะแห่งจิตที่เป็นอิสระนี้นี่แหละ ที่พระองค์บอกว่าจะสามารถ
เชื่อมต่อกับพุทธภาวะได้ และจะเข้าใจสิ่งที่เป็นสัจจะแห่งคําสอน และแยกออกว่าอะไรคือสมมุติ อะไรคือความจริงเราจะไม่ผูก
ติดอยู่กับสมมุติที่หลงเข้าใจว่าเป็นจริงมาโดยตลอด เราจะเห็นสมมุติเป็นสมมุติ เห็นความจริงเป็นความจริง ประจักษ์กับใจตัวเอง 
แต่ขบวนการนี้จะเกิดขึ้นได้จากการปฏิบัติตามหลักมรรคแปดซึ่งเราใช้ชีวิตอยู่ในโลกนี้เราดําเนินตามหลักมารรคแปดได้แค่ไหน 
ก็ขึ้นอยู่กับว่าความรู้ความเข้าใจ นําไปสู่การปฏิบัตินั้นเรามีความรู้ความเข้าใจมากเพียงใด ไม่ได้ขึ้นอยู่กับการดลบันดาลจากใคร 
แต่เราเองนั่นแหละจะเป็นผู้บันดาลชีวิตเราเอง จะให้เป็นผู้สุขหรือผู้ทุกข์",,
สติเป็นส่วนหนึ่งของสังขารกับสัญญาขันธ์ไหม เพราะว่าเคยไปฟังธรรม มีพระที่ฟังกันอยู่เป็นประจําบอกว่าสังขารมันเกิดจากเวทนาแล้วก็สัญญา อันนี้ถูกไหมคะ ,เอาตามที่พระพุทธองค์อธิบายไว้ พระองค์อธิบายคําว่าสังขารไว้บ้าง เพราะปรุงแต่งรูป เพราะปรุงแต่งเวทนา เพราะปรุงแต่งสัญญา เพราะปรุงแต่งสังขาร เพราะปรุงแต่งวิญญาณจึงชื่อว่าสังขาร การปรุงแต่งรูป การคิดในรูปอย่างใดอย่างหนึ่งไว้ การคิดในเวทนาอย่างใดอย่างหนึ่งไว้ การคิดถึงความจําอย่างใดอย่างหนึ่งไว้ การคิดในสิ่งที่เธอเคยคิดอย่างใดอย่างหนึ่งไว้แล้วการคิดในสิ่งที่ตัวเองเคยรับรู้ในสิ่งใดสิ่งหนึ่งไว้ หรือการคิดรวมกันทั้งหมด ในคราวเดียวนั้นไว้ นั่นคือสังขาร,00.29.14,00.30.29
