question,answer,start_time,end_time
*คำบรรยายต้นคลิป*,มนุษย์ทั้งหลายไม่ค่อยเข้าใจความเป็นธรรมดาที่พระองค์ตรัสสอนและชี้ให้เราได้เห็น ที่มันประจําอยู่ในจิตในใจหรือในตัวในตนในธาตุในขันธ์ เพราะฉะนั้นมันเป็นสัจจะ เมื่อไม่เข้าใจก็ปฏิบัติต่อมันไม่ถูก เมื่อปฏิบัติต่อมันไม่ถูกก็เลยเก็บเอาความวุ่นวายมาเป็นปัญหาต่อ หลักการของพุทธศาสนาคือให้ไปเห็นว่าไอความวุ่นวายเนี้ยมันเกิดแล้วมันดับไปตามกฎสัจธรรม หน้าที่ของเราคือเข้าใจการเกิดขึ้นของมัน เข้าใจการตั้งอยู่หรือปรุงแต่งจิตเราอยู่ให้เป็นความวุ่น แรกๆจิตอาจจะยังไม่สามารถอดทนต่ออาการวุ่นวายที่มาปรุงแต่งกลิ่นได้ แต่เมื่อเรายอมเพื่อที่จะเรียนรู้มัน ต่อไปเราจะมีสติปัญญาขึ้นมารับรู้ในความวุ่นวายนั้น เมื่อสติปัญญามันได้เกิดขึ้นแล้ว ความวุ่นวายผ่านเข้ามาในจิต จะไม่ทําให้เรามีความทุกข์กับความวุ่นวายที่กําลังเป็นอยู่ จิตเราก็จะอยู่เหนือความวุ่นวายนี้ได้,00.00.16,00.01.10
