question,answer,start_time,end_time
ทีนี้แสดงว่าบทสวดมนต์ ไม่ว่าใครจะสวดก็คือจะมีผลเหมือนกัน ,ไม่ ไม่เหมือนกัน เพราะไม่เข้าใจวิธีการสวด ไม่ได้สวดตามหลักแบบพุทธวิธี  สวดเพื่อความเข้มขลังก็ผิด ส่วนเพื่อขจัดปัดเป่าก็ผิด สวดเพิ่มบีบคั้นทําร้ายก็ผิด สวดเพื่อความศักดิ์สิทธิ์ก็ผิด สวดเอาความสงบก็ผิด พระพุทธเจ้าไม่ต้องให้เอาความสงบจากวิธีการสวด ความสงบนั้นเป็นความสงบนอกพุทธศาสนา ไม่ใช่ความสงบในพุทธศาสนา ความสงบของพุทธศาสนานี่เป็นความสงบที่เรียกว่าสันติ  สันติคือกาวความสงบที่เกิดจากการกําจัดเหตุแห่งความวุ่นวายภายในใจได้เสร็จสิ้น ก็คือใช้หลักของสัมมาทิฐิเพราะฉะนั้น การสวดมนต์จึงไม่ใช่คําตอบของพุทธศาสนา พระองค์ตรัสรู้แล้ว จึงไม่ได้บัญญัติเรื่องการสวดมนต์ไว้ แต่ที่พระองค์อนุญาตให้สวดปริตร มันมีผลดีต่อพุทธบริษัท มีความสําคัญและให้ผลดีในการคุ้มครองรักษา ป้องกันต่อพุทธบริษัท พระองค์ก็เลยอนุญาตให้สวด แต่ไม่ได้สวดมนต์ ให้สวดปริตร ไม่ได้สวดเป็นมนต์ พุทธศาสนาไม่ ไม่ได้ใช้คําว่าสวดมนต์ ใช้คําว่าสวดปริตร   ,00.42.45,00.44.08
ถ้าอย่างนี้สวดภาษาไทยกับบาลีจะให้ผลต่างกันไหมคะ,เหมือนกัน เหมือนกัน ถ้าไปสวดบาลีแล้วไม่รู้จักภาษาบาลี ก็ไม่ให้ผลเพราะพระองค์บอกว่าอักขระพยัญชนะ ต้องออกให้ถูกและต้องเข้าใจความหมายในการสวด และต้องตั้งจิตเมตตาในขณะที่สวด ไม่ได้จงใจเพื่อจะเอาให้ตายกันไปข้างหนึ่งเลยก็ได้มันเป็นการสวดเพื่อปลดปล่อยให้ภาวะที่บีบคั้น ตัน เป็นอิสระจากการก่อกวนและบีบคั้นต่อกันและกัน,00.44.09,00.44.43
แต่ว่าการสวดนี่คือการสื่อสารใช่ไหมคะพระอาจารย์  ,มันเป็นลักษณะ ของถ้าจะใช้คําว่าปริตร ถ้าจะแปลตามตัวครับว่า เครื่องป้องกัน ถ้าไปอ่านในรัตนปริตร  เขาเขียนไว้ว่าเทวดาในแสนโกฏิจักรวาล ยอมรับเอาอาชญาแห่งพระปริตรนี้ เพื่อเป็นเครื่องป้องกันอันตรายอันเกิดจากอมนุษย์เบียดเบียน อันเกิดจากการดํารงชีพที่ฝืดเคือง อันเกิดจากโรคระบาด เทวดาในแสนโกฎิจักรวาลยอมรับซึ่งเอาอาชญาแห่งพระปริตรนี้ คำว่าเป็นอาชญาคืออะไรก็บทลงโทษ บทลงโทษในหมู่ชาวทิพย์ ชาวทิพย์ที่ไม่หวังดีคอยก่อกวนในมนุษย์ เป็นอาชญาสําหรับชาวทิพย์ พระองค์จึงให้สวด  ,00.44.45,00.45.47
พระอาจารย์แล้วถ้าเทวดาเป็นฝรั่ง แล้วเราสวดภาษาไทย เขาจะเข้าใจไหมคะ ,ในทางภาษา พระอาจารย์เชื่อว่าเขาสามารถรับรู้รับทราบได้ ความเชื่อนี้มาจากการที่มีคนญี่ปุ่นคนหนึ่งขึ้นไปอยู่บนดอยเวียงเกี๋ยงเขาไม่ได้นับถือศาสนา แล้วเขามีทัศนคติที่ไม่ดีต่อพุทธศาสนาด้วย เขาจะทะเลาะกับภรรยา เกี่ยวกับการที่จะชวนเขาไปวัดเสมอ แล้วห้ามภรรยาพูดเรื่องพระ มีรูปพระในบ้านไม่ได้  เขาถือว่าภาพเป็นส่วนเกินของคนในสังคม เอาเปรียบคนในสังคม ถ้าจะทําบุญกับพระเขาก็บอก ไปทําบุญกับเด็กยากไร้ดีกว่า สุดท้ายก็ถูกล่อลวงไปบนดอยเวียงเกี๋ยงบอกไปเที่ยวป่า ก็ไป พอไปเจออาตมาก็หันหลังให้เลย ก็คงจะหงุดหงิดอยู่พอสมควร ฉุนเฉียวแต่ก็ยังไม่แสดงออก เพราะว่าเขามีมารยาททางสังคมอยู่พอสมควรเป็นหงุดหงิดนั่งหันหลังเลย ไม่ยอมคุย ไม่ยอมพูด ก็เลยตําส้มตํามาให้ ให้กิน ก็นั่งกินส้มตํา อาตมาคัดเทศน์กับโยมคนไทยนี่แหละ เทศน์ไปเทศน์มา ก็ค่อยหันกลับมา มาดู หันกลับมาดู ก็นั่งฟังอยู่นั่นแหละ นั่งฟังจนจบ นั่งฟังจบก็คลานเข้าไปหาเลย ขอลายเซ็น ขอผ้าจีวร ขออะไรก็ไม่รู้ ขอไปเลยทีนี้ ก็ให้เขาไปถามภรรยาว่า ทําไมเขามีความรู้สึกอย่างนี้ ซึ่งปกติเขาจะไม่แสดงออกอย่างนี้เขาบอกว่าเขาไม่รู้เป็นยังไง เขาฟังพระอาจารย์พูด เหมือนเขารับรู้อะไรบางอย่าง ในสิ่งที่ดี เขาบอกเสียงนี่ มันไม่ใช่เสียงของคนทั่วไปการเทศน์ การแสดงออกมามันแสดงออกถึงน้ำใจอะไรบางอย่างจากภายใน ออกมาสู่น้ำเสียงนั้น เขารับทราบได้ เขารับรู้ได้ แล้วเหมือนเขาจะรู้เรื่อง แต่จริงจริงไม่รู้เรื่องหรอก แต่รู้เรื่อง ว่ามันจัดเป็นความภายใน ในใจเขาเอง เหมือนเขารู้เรื่องอะไรบางอย่าง แต่ไม่รู้ว่าเขา เขาจะต้องรู้แบบไหน เพราะไม่มีภาษา เพราะภาษาที่เขาจะรู้กัน ไม่สามารถที่จะเข้าใจได้ แต่เขารู้สึกภายในว่าเขารู้เรื่องอะไรบางอย่าง จากสิ่งที่พระอาจารย์ได้พูด ฉันพูดมาเป็นภาษาไม่ได้ ก็เลยขออยู่ที่ดอย ไล่ ภรรยากลับบ้าน  เขาอยู่ที่ดอยอยู่เก้าวัน อยากจะขอบวช อาจารย์ก็ไม่ให้บวช จากคนที่ไม่รู้เรื่องอะไรเลย แล้วพระอาจารย์ก็เลยเชื่อว่า ชาวทิพย์สามารถรับรู้รับทราบภาษา แม้จะไม่ใช่ภาษาเดียวกันก็ได้ แต่มันมีกระแสอะไรบางอย่างที่ทําให้รับทราบภายในอยู่,00.45.48,00.49.13
ที่ทํางานจะมีการไหว้ศาลพระพรหมที่บริษัทเราควรตั้งใจว่าอย่างไรคะ เพราะเคยฟังพระอาจารย์ไม่ควรกราบไหว้สิ่งเหล่านี้ ,ฐานะชาวพุทธเรา เราควรจะแสดงออกถึงความเป็นพุทธศาสนากันให้มากกว่านี้ อย่าเกรงกลัวต่อการที่จะแสดงความเป็นพุทธศาสนาออกมา การสักการะกล่าวว่าอย่างนั้น ไม่ใช่พื้นฐานของ สัจธรรมในหลักคําสอน มันเป็นเพียงแค่อิทธิพลของจารีต ซึ่งอิทธิพลของจารีตมันเป็นเรื่องราวที่ถูกความเชื่อเข้ามาครอบงํา เพื่อให้เกิดการกระทําแบบนั้น แต่เมื่อมัน ไม่ใช่หลักการทางศาสนา เราก็ไม่ควรจะยินยอมให้หลักการเหล่านั้น มาเป็นส่วนหนึ่งที่เราควรจะประพฤติตาม ถามว่าถ้าเราไม่ประพฤติตามก็ขัดแย้งเขาสิ เราก็ต้องถามเขาว่า คนศาสนาคริสต์ เขาต้องมาไหว้ไหม ที่ทํางานด้วยกัน คนศาสนาอิสลามก็ต้องมาไหว้ไหม ไม่ต้องมาไหว้ เขาบอกเอาใคร เอาคนพุทธ แล้วถามว่า คนพุทธเราต้องไหว้สิ่งเหล่านี้ไหม ก็ไม่ใช่ แล้วทําไมเราจะไม่ยืนยันความเป็นพุทธของเราที่จะไปไหว้อย่างนั้น เพราะมันเป็นศาสนาอะไรไหว้ศาลพระพรหมภพภูมิ ถ้าศาสนาผี ศาสนาพรหม ศาสนา อะไรก็แล้วแต่ก็จะว่ากันไป แต่ไม่ใช่พุทธศาสนาแน่นอนเมื่อไหร่เราจะสามารถแสดงออกถึงจุดยืนของความเป็นพุทธศาสนาในฐานะพุทธศาสนาเอกชนที่จะแสดงถึงความเป็นพุทธศาสนานี้ได้ ทําไมเราต้องยอมคล้อยตาม ซึ่งมันไม่ใช่รากฐานของ สัจจะทางพุทธศาสนาที่ให้ทําอย่างนั้น  มันเป็นค่านิยมเฉยๆที่ทํารวมๆกันไป ซึ่งไม่ได้ประโยชน์อะไรหรอกพระพุทธเจ้าให้มนุษย์กับมนุษย์กราบไหว้กันเอง เคารพกันเองด้วยบุญ อภิวาทนสีลิสัส นิจจัง วุฑฒาปจายิโน เขาหมายถึงบุคคลสี่จําพวก ไม่ใช่เอามนุษย์ผีปีศาจเทวดาพรหม ที่เราจะต้องไปกราบไหว้ หมายถึงผู้เจริญโดยชาติโดยชาติ ผู้เจริญโดยวัย ผู้เจริญโดยปัญญาวุฒิผู้เจริญทางความรู้ทางปัญญา คุณวุฒิผู้เจริญโดยคุณ,00.49.21,00.51.44
สมมุติเรามีบ้านมากกว่าหนึ่งหลัง เวลาเราอุทิศบุญให้เทวดาประจําบ้าน เขาจะได้รับด้วยกันทุกหลังไหมคะ แล้วเทวดาที่มาประจําตัวเรา และประจําบ้านเรานี้ ใช้เกณฑ์อะไรในการคัดเลือกมาเจ้าคะ  ,เทวดาสถิตย์บ้านเมือง ทําบุญในบ้านหลังไหน ก็อุทิศผลบุญให้เทวดาผู้สถิตในบ้านหลังนั้น ถ้ามีหลายหลังในขณะที่เราอุทิศบุญสามารถนึกพร้อมกัน ถ้ามีสิบหลังก็นึกพร้อมกันทั้งสิบหลังได้ ก็จะไปครบ แต่ถ้ามีสิบหลังลึกด้วยสามหลัง ก็ไปแค่สามหลัง เพราะสัญญาณการไปของบุญไปตามการระลึกแล้วเขาจะคัดเลือกเทวดาประเภทใดมาเป็นเทวดาอารักขาประจําตัวมนุษย์ ทางท้าวจตุโลกบาลทั้งสี่ เขาจะเปิดโอกาสให้เทวดาที่นับเนื่องในหมู่ญาติลงมาก่อน มนุษย์ผู้นี้เป็นญาติของใครบนเทวโลก แล้วเทวดาตัวไหนประสงค์จะไปตามอารักขามนุษย์ที่อยู่บนมนุษย์โลก เทวดาเหล่านั้นจงออกมา เหล่าญาติที่พอใจจะลงมาเขาก็มา มาเป็นผู้อารักขา แต่ถ้ามนุษย์ไม่มีญาติเลยบนเทวโลก จตุมหาราธิกา ท้าวจตุโลกบาลทั้งสี่ก็จะจัดสรรเทวดาที่ อาสาหรือพึงพอใจ ปรารถนาบุญจากคนนี้ ก็ไป ถ้ามนุษย์ ได้รับการอรักขาจากเทวดาแล้ว เทวดาตามอารักขา ถ้าไม่อุทิศบุญให้เทวดาก็จะมีปัญหา ปัญหานั้นถูกกล่าวไว้ในพระไตรปิฎกก็คือเทวดาจะส่งสัญญาณให้ปวดศีรษะบ้าง ให้เกิดโรคไอบ้าง โรคจามบ้าง โรคเล็กเล็กน้อยน้อยพอให้รู้สึกตัวว่าเขาต้องการบุญ,00.51.51,00.53.49
พระปริตรเหมือนหนูเคยไปเห็นว่าให้ใช้สวดเฉพาะเวลาที่เราได้รับความเดือดร้อน แต่ว่าหนูเห็นว่าบางทีเราก็ไม่รู้ว่าเรากําลังได้รับความเดือดร้อนนั้นอยู่ แสดงว่าทั้งสามบทนี้เราสามารถที่จะสวดได้เป็นประจําไหม,ตอนแรกพระอาจารย์ก็เอาตามหลักการในพระไตรปิฎกนั่นแหละว่า มีเหตุจึงสวดไม่มีเหตุอย่าสวด แต่พอระยะหลังมาเนี่ย โยมเขา ใช้สวดอยู่เป็นประจํา  แล้วเขาได้ผลดี  ภายหลังเขาจะมาบอกว่าสวดเป็นประจํานั่นแหละ ไม่ต้องเลือกแล้วว่าควรสวดช่วงไหนเวลาไหน แต่อันนั้นยังเป็นข้อมูลเก่าเก่าที่ให้ปฏิบัติในรุ่นเก่าเก่าอันนี้ เพิ่งจะมาได้ข้อมูลเมื่อไม่กี่เดือนวันนี้ จากโยมที่เขาสวดอยู่เป็นประจําได้ผลดีอยู่ ก็เลยให้เขาสวด,00.55.09,00.56.04
ในพระปริตรค่ะ มีคําว่าสัตบุรุษนี่หมายถึงอะไรคะพระอาจารย์ ,สัตบุรุษคือบุรุษ ผู้ประกอบด้วยเหตุและผล คือมีเหตุผล  มีคุณธรรม มีเหตุผล สัตบุรุษ  ถ้าจะเอาแบบย่อคือสาม แบบละเอียดคือเจ็ด สัตบุรุษ เอาแบบย่อคือสามคือ 1 ผู้มีคุณธรรม ในเรื่องของหนึ่ง จาคะ คือการสละแบ่งปันสิ่งของของตนแก่คนอื่น 2 การดูแลมารดาบิดาของตนให้เป็นสุข 3 การถือการบวชเพื่อเป็นอุบายเว้นจากการเบียดเบียนซึ่งกันและกัน ผู้เข้ามาถือบวชในบางคราว เพื่อเป็นอุบายเว้นจากการเบียดเบียนซึ่งกันและกัน เป็นสัตบุรุษ องค์คุณของสัตบุรุษ เขาเรียกศัพท์โพธิสัตว์บัญญัติ สามประการ ถ้าเอาเจ็ดประการก็ หนึ่ง รู้เหตุ รู้เหตุ  สอง รู้ผล สาม รู้กาล สี่ รู้ประมาณ ห้า รู้บริษัท หก รู้ตน เจ็ด รู้บุคคล รู้บุคคลที่หมายถึง บุคคลไหนควรคบไม่ควรคบ เลือกให้ถูก,00.56.06,00.57.51
หากเราปลงผมเองและถือศีลแปดเอง จะถือว่าเป็นการบรรพชาไหมคะ ,ใช่ เป็นบรรพชา ถือบวช อธิษฐานเพศบวชด้วยตัวเอง,00.58.50,00.59.00
การบวชมันไม่จําเป็นต้องให้ใครมาบวชให้อย่างนี้หรือ หรือว่าจําเป็น,ถ้าเป็นสามเณรกับภิกษุ ต้องมีพระอุปัชฌาย์บวช ถ้าต่ำกว่านั้นไม่ต้องมีอุปัชฌาย์บวช บวชเองได้ อธิษฐานเพศได้  ไม่ต้องมีอุปัชฌาย์,00.59.51,00.59.17
ถ้าเป็นอย่างนี้แปลว่าคนที่ทําบุญบ่อยๆก็จะอุทิศบุญให้เทวดาเป็นประจํา แล้วก็อุทิศกุลให้เทวดาเป็นประจํา ก็จะมีเทวดาดูแลเยอะเลยใช่ไหมคะ,อาจไม่เยอะก็ได้ อาจจะเท่าเดิมนั่นแหละ แต่มีอานุภาพมากขึ้น อย่าเอามาเยอะเลยเทวดา อย่ายุ่ง พอจะให้ช่วยงานก็บอก มึงไปๆ เทวดาขี้เกียจก็มี,00.59.23,00.59.52
พระอาจารย์คะ แล้วเมื่อกี้เหมือนพระอาจารย์บอกว่า เทวดาตอนที่เขายังไม่ได้เป็นเทวดามีมิจฉาทิฐิ ตอนเขาเป็นเทวดาแล้วเขามีสัมมาทิฐิหมายถึงยังไง,ก็เวลามีคนอุทิศบุญให้เขาจะรู้ด้วยเขาจะรู้ว่า เขาดํารงอยู่ได้ด้วยบุญ เขาจะเริ่มมองเห็นคุณค่าของความดี  มีกบตัวหนึ่งตายไปแล้ว ไปเกิดอยู่บนสวรรค์ เพราะการฟังเทศน์ของพระพุทธเจ้า เขาเพิ่งจะรู้ว่า ขนาดเขาฟังแค่นี้ แบบไม่รู้เรื่องเขายังขึ้นสวรรค์เลย ตอนไปเป็นเทวดาเขาเลยบอกว่า ไม่ได้การแล้ว เราไม่ควรที่จะมาเสวยผลบุญอยู่เพียงแค่นี้ เราควรจะไปสะสมบุญให้มากกว่านี้ ลงมาจากเทวโลกมาฟังต่อ ถ้าฟังแบบไม่รู้เรื่อง ยังเกิดเป็นเทวดา แล้วฟังรู้เรื่องจะขนาดไหน เกิดสัมมาทิฐิขึ้นมาเลยทีนี้ ,00.59.55,1.00.47
