question,answer,start_time,end_time
บทสวดธัมมจักกัปปวัตนสูตรสวดได้ไหม ,หากบุคคลใดก็ตามเข้าใจในบทสวดนี้ทุกข้อความที่สวดออกไปมีความเข้าใจในบทธรรมนี้สวดได้เพราะยิ่งสวดยิ่งสร้างความเข้าใจให้กับจิตใจอยู่ตลอดเวลาแต่หากบุคคลใดไม่ได้เข้าใจในข้อความในบทสวดในธัมมจักกัปปวัตนสูตรขึ้นต้นด้วยว่า เอวัมเม สุตังฯ เอกัง สะมะยัง ภะคะวา พาราณะสิยัง วิหะระติ อิสิปะตะเน มิคะทาเย เป็นข้อธรรมที่เราจะต้องรู้และเข้าใจว่า เอวัมเม สุตังฯ เอกัง สะมะยัง ภะคะวา มันคืออะไร หากบุคคลผู้สวดไม่รู้ไม่เข้าใจว่ากล่าวถึงอะไรหรือพูดถึงอะไรหรือมีความหมายว่าอย่างไร ก็ไม่ควรสวดเพราะนั่นเป็นการสวดที่ไม่ได้รู้เรื่องและไม่ได้เข้าใจแต่หากรู้ความหมายของการสวดว่า เอวัมเม สุตังฯ คืออะไรอย่างอาตมารู้ว่ามันคืออะไรแปลว่ายังไงเนื้อความในธรรมนั้นเป็นเป็นยังไงก็สวดได้ แต่ก็ไม่จำเป็นต้องสวดเพราะรู้แล้วก็ไม่จำเป็นต้องสวด มีอยู่คราวครั้งหนึ่งที่ภิกษุรูปหนึ่งพยายามพากเพียรเจริญกรรมฐานปฏิบัติภาวนาสาธยายบทธรรมของพระพุทธเจ้าอยู่ในราวป่า สาธยายบทธรรมที่ทรงจำมาจนบทธรรมที่สาธยายนั้นเกิดความรู้แจ้งในภายในพอเกิดความรู้แจ้งในภายในแล้วท่านก็หยุดสวดเทวดาที่สถิตย์อยู่ในลาวป่าสถิตตามต้นไม้ เคยฟังบทสาธยายธรรมของภิกษุรูปนี้อยู่ทุกวันทุกวันเกิดความปิติยินดีในบทสวดแต่มีอยู่วันหนึ่งวันที่ภิกษุรู้แจ้งในบทธรรมนั้นแล้วหยุดสวด เทวดาไม่ได้ยินบทสวดก็เลยเกิดความสงสัยว่าภิกษุนี้คลายความความเพียรแล้ว ขี้เกียจไม่ตั้งมั่นอยู่ในธรรมคําสอนของพระสัมมาสัมพุทธเจ้าไม่พากเพียรไม่มีการสาธยายบทธรรม ภิกษุเหล่านั้น ภิกษุนั้นเป็นผู้รู้แจ้งในบททำก็โน้มจิตไปเสวยแต่วิมุตติสุข ไม่สนใจกับการสวดอีกเลยตลอดกาลในวันนั้นมา ตั้งแต่วันนั้นมาไม่สวดอีกเลย เทวดานี้ซึ่งเคยได้ยินบทสวดอยู่เป็นประจำด้วยความติดจนคุ้นหูแล้วไม่ได้ยินในวันนั้นก็เลยรู้สึกหงุดหงิดนี้คือการติดในบทสวด การติดในบทสวดนี่อันตรายการติดแม้บทสวดนั้นเป็นบทธรรมก็จริงแต่ติดมันก็ไม่ดีเพราะไม่ได้รู้เนื้อหาของธรรม เทวดานั้นก็เลยปรากฏตัวว่ามาต่อหน้าพระภิกษุแล้วกล่าวต่อภิกษุว่าท่านเป็นผู้คลายความเพียรเสียแล้วเป็นผู้ประมาทเป็นผู้ขี้เกียจทําไมไม่สาธยายบทธรรมของสัมมาสัมพุทธเจ้า ภิกษุนั้นบอกว่าประโยชน์อะไรกับการสวดประโยชน์อะไรกับการสาธยายกิจของการสวดไม่มีกิจของการสาธารณะไม่มีอีกแล้วฉะนั้นจุดประสงค์ของการสาธยายหมายถึงว่าบุคคลผู้สวดหรือสาธยายนั้นจะต้องเป็นการสวดและสาธยายเพื่อให้ตนเองเข้าใจในเนื้อหาธรรมไม่ใช่สวดเพื่อบูชาสักการะ เส้นสรวง เซ่นไหว้ กราบไหว้ หรืออะไรต่างต่างที่เข้าใจในแง่มุมอื่นแต่บางส่วนนั้นจะต้องเป็นการสวดเพื่อให้จิตได้เข้าใจในเนื้อหาธรรมแต่โดยส่วนมากแล้วบุคคลผู้สวดจะไม่ค่อยเข้าใจเนื้อหาของการสวดเมื่อไม่เข้าใจเนื้อหาของการสวดจิตจะไปเข้าใจเนื้อหาของธรรมที่สวดขึ้นมาได้อย่างไรจะไปเข้าใจไม่ได้เพราะฉะนั้นการสวดจึงเป็นการสวดเพราะการยึดติด ติดอยู่กับบทสวดว่าเป็นบทสวดที่ดีไม่ต่างจากเทวดาผู้ได้ยินบทสวดนั้น เทวดาที่ชื่นชอบในบทสวดก็มีแต่เป็นเทวดาประเภทที่ชั้นต่ำประเภทที่ชั้นที่เรียกว่าชั้นความงมงาย ไม่ใช่ว่าเทวดาจะดีเสมอไปเทวดาประเภทที่สติปัญญาไม่พัฒนาก้าวไปสู่การปฏิบัติเป็นเทวดาที่ติดอยู่เพียงแค่ความไพเราะความเป็นบทธรรมเท่านั้นไม่ได้รู้เรื่องหรือไม่ได้เข้าใจเนื้อหาของธรรม อาตมาก็ยอมรับว่าบทสวดบางบทสวดเขาแต่งออกมาได้ไพเราะและก็สวดได้ออกมาในทํานองที่ไพเราะแต่การยึดติดในเสียงที่ไพเราะ พระพุทธเจ้าบอกว่าจิตย่อมห่างออกจากสมาธิจิตที่ห่างออกจากสมาธิย่อมไม่ตั้งมั่นเมื่อจิตไม่ตั้งมั่นย่อมเกิดราคะในเสียงยินดีในเสียงจิตย่อมเป็นไปเพื่อความฟุ้งซ่านในเสียงไม่ตั้งมั่นจิตที่ไม่ตั้งมั่นก็ไม่สามารถรู้เห็นธรรมตามความเป็นจริงได้ จุดประสงค์ของพุทธองค์มีจุดมุ่งหมายเพื่อให้เขาไปรู้เห็นธรรมตามความเป็นจริงที่เรียกว่ารู้เห็นด้วยญาณทัสนะคือรู้เห็นตามความเป็นจริงในหลักธรรมในสภาวะธรรม ไม่ใช่สวดกันมาไม่รู้กี่ปีกี่ภพกี่ชาติก็สวดกันอยู่อย่างงั้น สวดได้ไหมถ้ารู้เรื่องสวดได้แต่ถ้าไม่รู้เรื่องอย่าสวดดีกว่าเพราะมันจะเกิดโทษในเรื่องการติดยึด,00.03.03,00.08.45
พระพุทธเจ้าไม่ได้ตรัสให้เอาพระพุทธรูปเป็นตัวแทนพระองค์ทรงมีรับสั่งว่า พระธรรมวินัย พระธรรม พระวินัยที่เราตถาคตแสดงบัญญัติแล้วพระวินัยพระธรรมนั่นเป็นตัวแทนเราตถาคตถูกต้องไหม,ใช่ ถูกต้องนี่คือตอบตามพุทธบัญญัติหรือพุทธพจน์ของพุทธเจ้าคือพุทธเจ้าบอกให้เอาธรรมและวินัยคือยึดถือตามพระพุทธเจ้า,00.08.56,00.09.32
พระพุทธเจ้าเคยชมเชยพราหมณ์ที่บูชาพระสุวรรณเจดีย์ของพระสัมมาสัมพุทธเจ้ากัปสัปปะว่าไม่มีใครสามารถที่จะนับบุญของผู้บูชาพระพุทธเจ้าหรือสาวกของพระพุทธเจ้าผู้ก้าวล่วงธรรมเป็นเห็นเนินช้าทำเป็นเครื่องเนินช้า ผู้ข้ามฝั่งแห่งความสุขและปริเทวะได้เลยและทรงตรัสว่าเมื่อจิตเสมอผลย่อมเสมอสัตว์ทั้งหลาย ทั้งสัตว์ทั้งหลายย่อมไปสู่สวรรค์เพราะความเลื่อมใสแห่งใจ,เป็นการยกเรื่องของการบูชาสุวรรณเจดีย์คือพูดในส่วนของบุญ บุญเป็นเครื่องส่งผลให้เป็นไปในวัฏฏะต้องเข้าใจว่าขอบเขตของบุญส่งผลให้เป็นไปในวัฏฏะ แน่นอนว่าการบูชาสุวรรณเจดีย์เราต้องแยกคัดแยกคําว่าเจดีย์กับพุทธรูปให้ออก เจดีย์นี้เป็นสิ่งที่พระพุทธเจ้าทรงอนุญาตไว้พูดง่ายๆว่าสิ่งที่เป็นที่ควรค่าแก่การสักการะเคารพบูชาในเรื่องของอามิสคือวัตถุที่พระองค์ทรงอนุญาตไว้มีธาตุเจดีย์ ธาตุเจดีย์หมายถึงว่าตัวธาตุเจดีย์ที่แท้จริงก็คืออัฐิ ธาตุหรือว่าเรียกว่าพระบรมสารีริกธาตุของพระสัมมาสัมพุทธเจ้าและของพระอรหันต์ตัสสาวก คือพระบรมสารีริกธาตุกับพระอัฐิธาตุของพระพุทธเจ้ากับพระสาวก แต่ในคําว่าธาตุเจดีย์มุ่งหมายกล่าวเฉพาะ พระบรมสารีริกธาตุเท่านั้นเรียกว่าธาตุเจดีย์นี้คือสิ่งที่พระองค์ทรงอนุญาตให้สักการะกราบไหว้บูชาของพระสาวกก็ให้สักการะบูชาจัดอยู่ในส่วนของธาตุเจดีย์เหมือนกัน บริโภคเจดีย์คือที่ที่พระองค์ทรงเคยบริโภคใช้สอย มี ต้นโพธิ์ มีกุฏิ มีภาพบังสุกุลของพระองค์ เครื่องใช้ไม้สอย รวมไปถึงรองเท้า ที่ประสูติ ตรัสรู้ปรินิพพาน คือ เป็นวัตถุหรือว่าเป็นที่สักการะที่พระองค์ทรงอนุญาตไว้เรียกว่าบริโภคเจดีย์กับเจดีย์อีกอันหนึ่งเรียกว่าอุเทสิกเจดีย์ พระองค์ทรงตรัสบอกว่าอุเทสิกเจดีย์นี้ไม่มีวัตถุปรากฏจะไม่สามารถกล่าวชี้ชัดลงไปในอันใดอันหนึ่งว่า อะไรคืออุเทสิกเจดีย์แต่ในคําว่าอุเทสิกเจดีย์นั้นพุทธองค์ทรงบอกว่าคําว่าอุเทสิกเจดีย์นั้นเป็นสิ่งที่เนื่องด้วยพระตถาคตอะไรก็ตามที่เนื่องด้วยพระตถาคตที่ไม่ใช่วัตถุ ต้องเข้ากันกับหลักนี้ด้วยอุเทสิกเจดีย์ไม่มีวัตถุปรากฏแต่เป็นสิ่งที่เนื่องด้วยพระตถาคตคํานาคกับคําหลังต้องเท่ากัน อะไรก็ตามที่เนื่องด้วยพระตถาคตแต่ไม่ใช่วัตถุอันนั้นเรียกว่าอุเทสิกเจดีย์เช่นอะไรบ้างการกล่าวธรรมบุคคลผู้กล่าวธรรมไม่รู้ผู้แสดงธรรมนั่นคือเป็นกล่าวถึงอุเทสิกเจดีย์มันคือเป็นสิ่งที่กล่าวถึงพระตถาคต บุคคลผู้กล่าวเป็นอุเทสิกเจดีย์แต่ตัวบุคคลไม่ใช่อุเทสิกเจดีย์ บุคคลผู้กล่าวธรรมที่ออกมาจากตัวของบุคคลนั้นเป็นอุเทสิกเจดีย์บุคคลผู้กล่าวทำจึงเป็นบุคคลผู้ควรค่าแก่การเคารพ นั่นคืออุเทสิกเจดีย์ การโน้มจิตระลึกถึงพระพุทธเจ้า พระธรรม พระสงฆ์ คําว่าพุทธเจ้า พระธรรม พระสงฆ์ ไม่ใช่วัตถุเป็นนามนั้นยังเป็นอุเทสิกเจดีย์เกี่ยวเนื่องกันเป็นอุเทสิกาเจดีย์ เพราะฉะนั้นใครก็ตามระลึกถึงพระพุทธเจ้า พระธรรม พระสงฆ์ก็ได้เท่ากับว่าได้บูชาได้สักการะบูชาในส่วนของอุเทสิกะเจดีย์เพราะไม่ใช่วัตถุปรากฏ แต่เป็นสิ่งที่ พระตถาคตในภายหลังเขาจัดพระพุทธรูปลงในอุเทสิกเจดีย์จะขัดแย้งกับคําว่าไม่มีวัตถุปรากฏของที่พระองค์ทรงตรัสเนื่องด้วยตถาคตก็จริงแต่ในคําว่าเจดีย์นั้นกล่าวไว้ชัดเจนว่าไม่มีวัตถุปรากฏ แต่ในแบบเรียนในตําราที่แต่งขึ้นมาจัดพุทธรูปอยู่ในอุเทสิกะเจดีย์จะขัดแย้งกับพุทธเจ้าโดยตรง เพราะฉะนั้นต้องแยกแยะให้ออกและต้องแยกแยะด้วยว่าเจดีย์อีกแบบหนึ่งพระพุทธรูปอีกแบบหนึ่ง พุทธรูปคือพุทธรูปไม่ใช่เจดีย์ เจดีย์คือเจดีย์ หมายถึงพระบรมสารีริกธาตุแล้วก็บริโภคเจดีย์แล้วก็อุเทสิกเจดีย์นั่นคือเจดีย์ ส่วนการสร้างวัตถุที่บรรจุพระบรมสารีริกธาตุนั้นเรียกว่าสถูป สร้างที่บรรจุวัตถุที่บรรจุจะเป็นทรงสถูปยอดแหลมแหลมพระปรางค์ พระสถูป พระอะไรก็ตามที่สร้างขึ้นมาเพื่อบรรจุ อันที่สร้างบรรจุไม่ได้เรียกเจดีย์แต่อันที่สร้างบรรจุถูกเรียกเจดีย์โดยการที่พระบรมสารีริกธาตุนั้นเป็นเจดีย์ ถ้าเจดีย์เกิดขึ้นต่อเมื่อตถาคตละชีวิตไปแล้วจึงมีธาตุเจดีย์คือพระบรมสารีริกธาตุของพระองค์ ส่วนเอาธาตุเจดีย์ไปบรรจุในสถูปใดสถูปนั้นจึงถูกเรียกว่าเจดีย์ด้วยเราจึงมักจะเข้าใจคําว่าเจดีย์หมายถึงว่าสิ่งที่สร้างเพื่อบรรจุที่ก่อสร้างขึ้นมาเพื่อบรรจุแล้วมียอดแหลมแหลมคือเจดีย์เพราะฉะนั้น ต้องแยกให้ออกหากว่าพระพุทธรูปใดมีพระบรมสารีริกธาตุเช่นเขาจะ เอาใส่ไว้บริเวณเศียรที่ถอดได้ พุทธรูปนั้นได้จัดว่าเป็นเจดีย์ไหมเป็นเจดีย์แต่หากพุทธรูปใดไม่ได้บรรจุพระบรมสารีริกธาตุของพระสัมมาสัมพุทธเจ้า เป็นเจดีย์ได้ไหมเป็นเจดีย์ไม่ได้ ผู้กราบไหว้จะต้องกราบไหว้ด้วยความเข้าใจด้วยว่าเรากราบไหว้พระบรมสารีริกธาตุคือเป็นธาตุเจดีย์เราไม่ได้กราบไหว้ที่รูปเคารพต้องเข้าใจอย่างนั้นถ้าเราแยกแยะไม่ออกเราจะมาปนกันว่าการไหว้เจดีย์กับไหว้พุทธรูปต่างกันแต่ต้องเข้าใจนะ พระองค์แม้จะบอกว่าการกราบไหว้เจดีย์แม้จะยังบุญกุศลของบุคคลผู้กระทำประมาณไม่ได้แต่ขอบเขตของบุญนั้นได้แค่สวรรค์คือได้แค่ให้เป็นไปในวัฏฏะเท่านั้นเองไม่เกินไปกว่านั้น ถามว่าหลักคําสองพระพุทธเจ้าหยุดอยู่เพียงแค่ให้มีบุญประกอบบุญไปเป็นไปในวัฏฏะหรือเปล่า ไม่ พุทธประสงค์ของพุทธองค์คือพระอรรถกถาทั้งหลายจึงบอกว่าการสร้างเจดีย์พันเจดีย์วิหารพันวิหารก็ไม่ได้ชื่อว่าเป็นการสืบต่อพระศาสนาเพราะอะไร เพราะบุญของบุคคลใดทำไว้บุญก็เป็นเฉพาะของผู้นั้นคือเป็นเรื่องส่วนตัวของคนไม่ได้เป็นเครื่องสืบต่อศาสนาใครทำคนนั้นได้บุญ ก็คนนั้นตายก็หมดแล้ว คนนั้นก็ไป เสวยผลบุญ แต่เรื่องของการสืบต่อศาสนาเป็นสิ่งที่มีความสำคัญกว่า การสืบต่อศาสนาเป็นสิ่งที่มีความสัมพันธ์ กว่าการที่จะประสงค์ สักการะอะไรอย่างใดอย่างหนึ่งแล้วเอาบุญทำแค่เอาบุญ พระพุทธเจ้าบอกว่ามันก็ดีแต่เป็นความดีฉันเลว ฉันเฉพาะตนเอง บุญใครทำก็ได้เฉพาะคนนั้นไม่ได้ไปสืบต่อศาสนา ได้บุญเฉพาะบุคคลเท่านั้น,00.09.58,00.19.07
