question,answer,start_time,end_time
อริยสัจสี่กับปฏิจจสมุปบาทเกี่ยวเนื่องหรือสนับสนุนทํากันอย่างไร เห็นพระพูดกันถึงบ่อยๆ,"มีความสําคัญมากเลยนะ เรารู้จักอริยสัจสี่ ถ้าไม่รู้จักปฏิจจสมุปบาทเราจะไม่เข้าใจหลักของการแก้กิเลส ว่าเราควรจะแก้กิเลสอย่างไร จริงๆแล้วถ้าใครรู้จักอริยสัจสี่ก็ต้องรู้จักปฏิจจสมุปบาทด้วย คือถ้าเป็นความรู้ที่ถูกต้องจะเกิดความรู้ในเรื่องของปปฏิจจสมุปบาทกับอริยสัจสี่ควบคู่กัน เพราะเป็นสิ่งที่เกี่ยวโยงกัน อริยสัจสี่เป็นการกล่าวถึงความเป็นไปของขันธ์ห้า ว่าขันธ์ห้าต้องเป็นทุกข์และในขันธ์ห้ามีเหตุของการนํามาซึ่งทุกข์ ทั้งความทุกข์และเหตุนั้น ในฐานะเองก็สามารถดับได้หรือมันดับ หรือมันร่วงไปเป็นไปตามเหตุปัจจัยของมันได้ คือมันเกิดแล้วมันดับได้ แล้วก็บุคคลผู้เข้าไปรู้ทุกข์ แล้วก็รู้เหตุของทุกข์ แล้วก็รู้ความดับของทุกข์ บุคคลนั้นคือผู้เจริญมรรค และเป็นความจริงคือเป็นสัจจะที่ว่าบุคคลผู้เจริญมรรคอยู่จะสามารถดับความทุกข์ได้ ส่วนปฏิจจสมุปบาทจะเป็นตัวบอกให้เราได้รู้ว่าสังโยชน์ที่ผูกจิตคืออะไร? แล้วสังโยชน์ที่ผูกจิตเราควรจะต้องแก้ไขโดยการเจริญอริยมรรคจากอริยสัจสี่ให้เพียงพอต่อการที่จะทําลายส่วนสังโยชน์ เพราะสังโยชน์ทั้งหลายฃอาศัยอวิชชาเป็นที่ตั้งคือความไม่รู้ ปฏิสัตย์สมบัติที่เริ่มต้นด้วยอวิชชาก็คือว่า เมื่ออวิชชาจึงมี กลุ่มสังขารทั้งหลายจึงมี เมื่อสังขารมี วิญญาณจึงมี เมื่อวิญญาณมี นามรูปจึงมี เมื่อนามรูปมี อารตนะจึงมี เมื่ออายตนะมี ผัสสะจึงมี คือพระองค์กล่าวถึงห่วงโซ่ที่เป็นปัจจัยอิงอาศัยกันและกัน แล้วห่วงโซ่ที่เป็นปัจจัยอิงอาศัยกันและกัน จะอยู่ในส่วนของสังโยชน์ก็คือกลุ่มสมุทัย เมื่ออวิชชาเกิดก็คือเกิด มันเกิดที่ทิฐิคือความเห็น ใครเห็นผิด? ก็ขันธ์ห้าคือบุคคลนั่นแหละเป็นผู้เห็นผิด คือบุคคลเป็นตัวแทนของคําว่าขันธ์ห้า คือขันธ์ห้าคือบุคคล มันมีความจริงสี่ประการคือทุกข์ เหตุของทุกข์ ความดับของทุกข์ แล้วก็บุคคลนั้นถ้าเจริญมรรคอยู่ก็จะได้เป็นผู้ทําให้อริยสัจครบสี่ประการภายในตัวบุคคลนั้น การที่เรารู้อริยสัจสี่เพื่อที่จะเข้าใจขันธ์ห้า
คือตัวเรา เพราะตัวเราที่แท้คืออะไร? เหตุที่นํามาสู่ขันธ์ห้าคืออะไร? ความดับของขันธ์ห้าคือดับอย่างไร? แล้ววิธีปฏิบัติต่อขันธ์ห้าควรจะปฏิบัติอย่างไร? คือเราให้เราเข้าใจตัวเรา แต่ในส่วนของการทําลายอาสวะ คือทําลายกิเลส จะต้องไปรู้เรื่องของปฏิจักษ์ ถ้าเราไม่รู้เรื่องว่าปฏิจักคือตัวทําลายกิเลสโดยตรง เราจะไม่สามารถละกิเลสได้ การที่เรารู้อริยสัจสี่ก็เพื่อที่จะทําให้เราไม่ต้องไปทุกข์กับขันธ์ห้าที่มันมีความทุกข์อยู่ การรู้จักอริยสัจสี่คือรู้ความจริงของขันธ์ห้าตามสัจจะสี่ ทําให้เราไม่ต้องทุกข์กับความทุกข์ทางขันธ์ห้า แต่ยังละกิเลสไม่ได้นะ การจะละกิเลสต้องไปละที่อวิชชาคือความไม่รู้ ความไม่รู้มันจะตั้งอยู่บนทิฐิคือความเห็นผิด ความเห็นผิดที่เห็นผิดในกายสังขารแล้วก็จิตสังขาร เมื่อมันมีความเห็นผิดในกายสังขารและจิตสังขาร ความเห็นตัวนี้จึงก่อให้เกิดสังโยชน์คือผูกใจเราให้ติดอยู่กับขันธ์ห้า ขันธ์ห้าไม่ใช่สังโยชน์ สังโยชน์ไม่ใช่ขันธ์ห้า สังโยชน์คือความเห็นผิดของเราที่มีต่อขันธ์ห้า ขันธ์ห้าเป็นตัวแสดงสัจจะคือ ทุกข์ สมุทัย นิโรจน์ แค่เป็นที่ตั้งแห่งสัจจะ คือตัวแสดงออกของสัจจะคือความจริง ฉะนั้นลําพังเพียงแค่การทําทุกข์ให้ดับไปโดยที่ไม่ได้ไปละที่อวิชชา การเกิดยังจะต้องมีอยู่ งั้นเราต้องไปนั่งที่อวิชชาด้วย โดยอาศัยการละที่เราจะต้องเข้าใจอริยมรรค อริยสัจก่อนที่จะเป็นอริยมรรค เมื่ออริยมรรคที่ถูกปฏิบัติจากอริยสัจ มันเกิดกําลังรู้แจ้งอย่างเต็มที่และก็มีกําลังในการเชื่อมต่อพระนิพพาน มันจะไปทําลายความเห็นผิดในสีลัพพตปรามาส ในส่วนนั้นเป็นส่วนปฏิจักษ์คือส่วนที่เป็นปัจจัยก่อเกิดหรือสิ่งที่อิงอาศัยทําให้ขันธ์ห้าสืบต่อในภพ เกิดแล้วเกิดเล่า เมื่อเอาวิชาถูกทําลาย มันก็จะเกิดปฏิจจสมุปบาทอีกสายหนึ่งก็คือสายดับ สายดับคือเป็นธรรมที่อิงอาศัยกันเพื่อดับ ดับอวิชชา เมื่ออวิชชาดับ กระบวนการสังหารทั้งหลายก็ดับจนไปถึงปัญหาดับ อุปทานดับ ภพดับ ชาติการเกิดใหม่ดับ ชรา พยาธิ ภาวนาดับ ฉะนั้นอริยสัจสี่กับปฏิจจสมุปบาท มันเป็นความสําคัญที่เราต้องเข้าใจอย่างนี้ให้ถูกต้อง",01.11.40,01.17.24
การุณยฆาตที่คนๆนั้นเลือกที่จะทําเองไม่บาป แต่อยากทราบว่าถ้าเราเป็นเจ้าของสัตว์เลี้ยงซึ่งสัตว์กําลังป่วยและทรมาน แล้วเราเลือกที่จะทําการุณยฆาตให้สัตว์ตัดความทรมานนั้นจะผิดไหม,ไม่ผิด พราะการตัดสินใจไม่ได้ตัดสินใจบนพื้นฐานของกิเลส หรือว่าความโกรธความอาฆาต หรือใจอยากจะให้เขาตายด้วยโทสะหรือความไม่ชอบใจ มันอยู่บนพื้นฐานความเมตตา เพราะฉะนั้นพื้นฐานเมตตาไม่ได้กําหนดความเป็นบาปในการกระทํานั้น,01.17.49,1.18.30
ผมเหมือนมีวิบากทํางานอยู่ที่ไหนไม่ได้นาน มีปัญหาจนต้องลาออกตลอด ตอนนี้อายุสามสิบสามแล้ว ยังอาศัยอยู่บ้านกับพ่อแม่ ที่บ้านก็มีเงินเลี้ยงดูผมตลอดชีวิตโดยไม่ต้องทํางานอะไรเลยก็ได้ ที่บ้านบอกว่าเรามีเงินเยอะแล้ว ไม่ต้องทํางานหรอก อยู่กับพ่อแม่นี่แหละ แต่ผมรู้สึกถูกขังอยู่ในบ้าน ไปเที่ยวที่ไหนก็ไม่ได้ พ่อแม่ก็ไม่ให้เงิน มีวิธีแก้วิบากกรรมนี้ไหมสมัยเด็กเคยเลี้ยงปลาทองสองตัวอยู่ในตู้ปลาเล็กๆจนมันตาย พอโตมาผมรู้สึกผิดเหลือเกิน เอาเขาไปขังในตู้เล็กๆเหมือนตอนนี้ที่กำำลังถูกขังอยู่ในบ้าน,ความรู้สึกนี้ที่เราเข้าใจว่าเป็นส่วนของวิบาก แล้วทําให้เรานึกถึงเหตุคือกรรมจากการเลี้ยงปลา วิธีการแก้ก็คือการทําบุญอุทิศส่วนกุศลไปให้ปลานั้น พร้อมกับกล่าวคําขอขมาโทษ คือเรื่องบางเรื่องที่เป็นวิบาก มันทําให้เรานํามาสู่การแก้ไขส่วนที่เป็นเหตุที่เราเคยกระทํามาให้ตรงจุด และอีกส่วนหนึ่งก็คือทําให้เราเกิดการพัฒนาและแก้ไขตนเอง เพื่อที่จะทําให้เรานั้นไม่ได้เป็นปัญหากับสิ่งที่เราเคยเป็นปัญหากับมัน หลายอย่างหรือหลายคนที่มีปัญหาในลักษณะนี้ คือทําการงานอะไรแล้ว ทําต่อไปได้ไม่นาน เป็นคนขี้เบื่อ ไม่อยู่กับความจําเจ เป็นคนที่ไม่สู้การสู้งาน แล้วก็อารมณ์ทางใจของเราทําให้เราไม่มีกําลังใจในการที่อยากจะกระทําการงานนั้น บางอย่างก็เกิดกรรมวิบากจากกรรมวิบากด้วย แล้วบางอย่างมันก็เกิดจากการที่เราไม่เข้าใจเหตุปัจจัยในการที่จะกระทําสิ่งนั้นให้ดี ให้ถูกต้อง ให้เป็นไปในทางพัฒนาตัวเองอย่างไร แต่ความรู้สึกของเรามันผูกติดอยู่กับปลา นั่นหมายถึงว่ามันมีความเชื่อมโยงกับกรรมวิบาก ฉะนั้นการทําบุญอุทิศส่วนกุศลและกล่าวขอขมาโทษปลานั้น เพื่อไม่ให้เกิดต่อเวรเชื่อมโยงส่งต่อแรงอาฆาตหรือพยาบาทมาถึงเรา ปลาแม้จะเป็นตัวเล็กๆ แต่ถ้าแรงอาฆาตก็ไม่ต่างจากจิตใจของคนเหมือนกัน เขาก็มีจิตใจเหมือนกัน ถ้าเขาได้ตั้งจิตอาฆาตไว้แล้ว กระแสของความอาฆาตก็ยังผูกโยงกันอยู่ วิธีการที่จะลดแรงอาฆาตได้ก็คือการขอขมา ให้ตั้งใจไว้ว่าข้าพเจ้าขอกล่าวคําโทษต่อปลาที่ข้าพเจ้าเคยเลี้ยงไว้จนถึงแก่ความตาย ด้วยความไม่รู้หรือด้วยความพลั้งเผลอ ความประมาทก็ว่าไป บัดนี้ข้าพเจ้าสํานึกผิดในการกระทําส่วนวิกฤตอันนั้น ขอให้ปลาที่ข้าพเจ้าเคยเลี้ยงไว้ จงรับรู้รับทราบสัญญาณการขอขมาของข้าพเจ้าและอดโทษและอภัยให้แก่ข้าพเจ้าด้วย ข้าพเจ้าจะทําบุญอุทิศส่วนกุศลให้ การกล่าวขอขมาอย่างนี้ควรจะเป็นการกล่าวขอขมาย้ำๆซ้ำๆอย่างน้อยเจ็ดเที่ยวเจ็ดรอบ เพื่อให้กระแสของการขอขมาส่งไปถึงปลานั้นและควรทําติดต่อกันเจ็ดวัน และการทําบุญที่กุศลก็ควรทําติดต่อกันเจ็ดวัน ไม่ต้องไปทําการอุทิศส่วนกุศลเป็นงานบุญใหญ่ เพียงแค่อาจมีน้ําสักขวด วันละขวด ให้ใครก็ได้แล้วอุทิศส่วนกุศลไปให้ปลานั้น,01.18.36,01.22.02
ท่องธาตุกรรมฐานและพิจารณากายหกขั้นตอนตามที่พระอาจารย์สอน ให้เกิดความรู้สึกว่าถ้าตายไปจิตออกจากร่าง ร่างกายก็ไม่ใช่ของเราแล้วก็เลยคิดว่าไม่ต้องจัดงานศพก็ได้แล้ว ไม่ได้อยากให้ครอบครัวต้องมาลําบากจัดงานศพให้ คนที่เรารักก็ต้องมาร้องไห้ในงานศพเราอีก เลยอยากเรียนถามพระอาจารย์ว่าถ้าไม่จัดงานศพก็ไม่เป็นไรใช่ไหม แล้วทําไมเขาต้องจัดงานศพกัน วัตถุประสงค์จริงจริงของการจัดงานศพคืออะไร,ถ้าได้เคยติดตามเพจครูเงาะหรือว่าเพจพระอาจารย์เองพระอาจารย์เคยเล่าเรื่องของพราหมณ์ที่พิจารณาความตาย ที่บุตรชายเขาได้ถึงแก่ความตาย พราหมณ์นั้นก็ไม่ได้จัดงานศพ ก็เรียกแค่ญาติพี่น้องมา แล้วก็เพิ่งก่อไฟเผากันเลยในวันนั้นเลย ไม่มีการจัดงานและไม่บอกกล่าวงานอะไรให้กดคนรับรู้รับทราบ มันเป็นภาระของคนในครอบครัวที่ควรจะจัดการกันเองในการเผาศพนั้น แต่เมื่อธรรมเนียมปฏิบัติพิธีกรรมมันถูกสืบทอดกันมาอย่างนี้แล้ว จริงๆพระอาจารย์ก็อยากจะแก้ไขในธรรมเนียมเหล่านี้เหมือนกัน เพราะประโยชน์เกิดขึ้นน้อยมาก สําหรับผู้ละชีวิตไปแล้วและเกิดโทษสําหรับบุคคลผู้จัดงานมีเยอะ คือเราสูญเสียบุคคลไปแล้ว อย่าให้สูญเสียอะไรอย่างอื่นตามมาอย่างที่ไร้ประโยชน์เลย ฉะนั้นคือมีหลายคนที่พระอาจารย์ได้จาริกไปในที่ต่างๆ แล้วก็ได้มีคําถามเหล่าขึ้นมาว่า ทําไมงานศพแต่ละงาน คือว่าญาติพี่น้องที่มีชีวิตอยู่ ที่จัดงานเป็นหนี้เป็นสิน แล้วก็เดือดร้อนกันเป็นส่วนมาก ทําไมเราจะต้อง เตรียมเงินไว้ตั้งมากมาย แล้วจัดงานอะไรตั้งขนาดนี้ ตามหลักพุทธศาสนาเราไม่ได้บอกว่าจะต้องจัดงานศพให้เป็นพิธีกรรมลักษณะอย่างนี้ ไม่จัดก็ได้ ก็คือมันไม่ได้เป็นความผิด ไม่ต้องกังวลใจ เราจะเขียนพินัยกรรมแบบนี้ไว้ก็ได้ว่าไม่ต้องจัดงานสูง พระอาจารย์ก็ยังจะสนับสนุนให้เป็นแบบนี้,01.22.26,01.24.34
จะต้องปฏิบัติอย่างไรดี มีเหตุที่ต้องพูดจาโต้แย้งกับสามีตลอดเลย พอมีเหตุเราดูจิตไม่ทัน ไม่เท่าทันและบางครั้งไม่ทันดูเลย ต้องฝึกสิ่งใดให้มากกว่านี้ ขณะนี้ระลึกถึงพระรัตนตรัยจนขึ้นใจแล้ว ท่องธาตุและบางครั้งเริ่มพิจารณากาย จนในบางครั้งก็ท้อมากๆหรือว่าเป็นวิบากของเรา,ข้อปฏิบัติของเรายังไม่เพียงพอในการที่จะไปแก้ไขสิ่งในจิตของเราได้ แล้วก็มันเป็นเขาเรียกว่าเป็นอนุสัยที่หนักแน่นมาก ในจิตและฝังแน่นในจิต นั้นเรื่องนี้ต้องต้องใช้เทคนิคของโยมครูเงาะให้มากๆ ติดตามกันบ้าง ผู้มีประสบการณ์มาอย่างงี้ แต่หลักการปฏิบัติธรรมเราก็ยังต้องทําอยู่ การระลึกถึงพระพระรัตนตรัย การท่องธาตุและพิจารณาร่างกาย ก็เราก็ควรทําไป การโต้แย้งกับสามีมัน มันก็เป็นส่วนหนึ่งของเวรด้วยอันหนึ่ง จะเรียกว่าเป็นส่วนหนึ่งของเวรด้วย แต่อาจจะเป็นส่วนหนึ่งที่เราไม่ได้เข้าใจแง่มุมบางประการ แต่ถ้าไปฟังโยมครูเงาะจะได้ประโยชน์ในด้านนี้,01.24.47,01.26.08
