question,answer,start_time,end_time
ในทุกสิบเอ็ดประการที่เราต้องเจอแน่ๆ พระพุทธเจ้าท่านแยกโสกะกับปริเทวะไว้ โสกะก็คือแปลว่าความแห้งใจหรือมีจิตใจแห้งผ่า ปริเทวะคือคร่ําครวญรําพัน แล้วในขณะเดียวกันมันก็จะมีเรื่องของความพลัดพรากจากสิ่งรัก อย่างสามตัวอย่างนี้ แล้วมันต่างกันยังไง,ความทุกข์ที่เกิดจากการพลัดพรากคือเราไม่ต้องการให้เกิดการพลัดพราก เราต้องการให้สิ่งที่อันเป็นที่รักอยู่กับเรา เมื่อเราไม่อยากให้เกิดการพลัดพราก เราจะทุกข์เพราะสิ่งนั้นได้พลัดพรากไปแล้ว อันนี้คือความทุกข์ที่เกิดขึ้น ความเสียใจก็คือเมื่อสิ่งนั้นได้เกิดพลัดพรากหรือสูญเสียไปแล้ว ความทุกข์ที่เกิดจากการสูญเสียก็จะเกิดความเศร้าโศก คือมันจะเป็นอารมณ์เป็นระลอกตามมาในเหตุปัจจัยเดียวกันก็ได้หรือต่างเหตุต่างปัจจัยก็ได้ ก็เกิดความเศร้าโศก พอเกิดความเศร้าโศกก็เกิดความทุกข์ต่อขึ้นมาอีก คือพิลี้พิไลรําพันหารําพึงรําพันหา ไม่น่าจากไป ไม่น่าด่วนไปเลย ประมาณนี้คือความทุกข์แต่ละอย่างเกิดจากเหตุต่างกันก็มี แต่เหตุเหมือนกันก็มี แต่อาศัยการเกิดขึ้นคนละช่วงของเหตุปัจจัย ความพลัดพรากนํามาซึ่งความไม่อยากจะให้เกิดการพลัดพรากคือ ทําให้ทุกข์เพราะไม่อยากจะให้เกิดการพลัดพราก พอเกิดการพลัดพรากแล้วก็รับรู้ถึงความสูญเสียสิ่งนั้น ก็เศร้าโศกถึงความสูญเสีย มันเป็นของตามมา เกี่ยวโยงกัน แล้วเมื่อทุกข์ใจเพราะความสูญเสียแล้วพิไลรําพันหารําพึงรําพันหา บ่นถึงอยู่เรื่อยๆอย่างนี้ ส่วนตัวโทมนัสก็คือความทุกข์ทางจิตเหมือนกัน แต่ต้องแยกเพราะว่าโทมนัสมันเป็นเพียงแค่ลักษณะของเวทนาที่เรียกว่าเจตสิกเวทนา เพราะเวทนามีอยู่สองส่วน คือส่วนที่เรียกว่ากายิกเวทนา ส่วนที่สองเรียกว่าเจตสิกเวทนา กายิกเวทนา ก็คือเวทนาทางกาย มีสุขบ้างทุกข์บ้าง ไม่ทุกข์ไม่สุขบ้าง เจตสิกเวทนา มีสามเหมือนกันก็คือ โสมนัสคือดีใจ โทมนัสคือเสียใจ แล้วก็อุเบกขาคือเฉยเฉย ฉะนั้นเมื่อใดก็ตามที่เรารู้สึกว่ามีทุกข์ ความทุกข์ทางใจเราก็เรียกว่าโทมนัส,00.34.33,00.38.08
รักผู้หญิงคนหนึ่งให้ทุกอย่างกับเขา ทําไมต้องทุกข์,ถูกต้อง มันเป็นความทุกข์ มันต้องเป็นอย่างงี้แหละความรัก พระองค์ตรัสไว้ ตามเหตุปัจจัยของเรื่องราวนั้นๆว่าทุกข์ย่อมเกิดจากสิ่งอันเป็นที่รัก ความกลัวทั้งหลายก็เกิดจากสิ่งอันเป็นที่รัก หรือว่าความเศร้าโศกก็เกิดจากสิ่งอันเป็นที่รัก บุคคลผู้ค้นแล้วจากความรัก ความทุกข์ ความเศร้าโศกและความกลัวจากมีมาแต่ที่ไหน ก็คือสิ่งที่พระองค์ตรัสไว้ชัดเจนแล้วว่ามันต้องทุกข์ นี่คือเรื่องปกติ เรื่องธรรมดา แต่เราไม่ค่อยเข้าใจว่าสิ่งนี้คือความเป็นปกติและเป็นความเป็นธรรมดา เราประสบกับเรื่องราวเหล่านี้ ก็เลยรู้สึกว่าเมื่อเรามีความรักกับผู้หญิง แล้วก็ให้ทุกอย่างกับเขา ทําไมเราไม่ได้รับความสุข ทําไมเรารับความทุกข์ ขอให้เราแยกแยะว่า หนึ่งกฎเกณฑ์ของความรักที่ทําให้เราผูกติดอยู่กับสิ่งที่อันเป็นที่รัก มันเป็นความทุกข์อยู่แล้วโดยธรรมชาติอันหนึ่ง อันที่สองด้วยความรักหรือเราให้ทุกอย่างกับเขา แต่เราไม่ได้กลับมามองว่าสิ่งที่เราทําให้เขาหรือสิ่งที่เราให้เขา เราให้เพราะเราต้องการความรัก สิทธิที่ในตัวเขา เราอาจจะมองว่าเราทําให้เขา แต่ที่แท้จริงแล้วเราทําเพราะเรามีใจรักที่จะทําอย่างนั้น,00.38.21,00.40.02
แม่ติดหนี้การพนันตลอด เคยกู้เงินมาช่วยแล้ว ก็ยังสร้างหนี้อีก หากไม่อยากช่วยแล้ว ทั้งที่ยังสามารถกู้เงินได้อีก จะบาปไหมหรือควรช่วยดี,ถ้าเรารู้อยู่แล้วว่าการกู้เงินมาช่วยแม่ โดยที่รับรู้ ทราบตลอดว่าแม่นําเงินส่วนนี้ไปเล่นการพนันและนํามาสู่การสร้างหนี้ แน่นอนมันเป็นส่วนหนึ่งที่เราจะได้รับโทษนั้นด้วย ไม่ช่วยก็ต้องไม่ช่วย คือต้องตัดใจเด็ดขาดเลย บาปไหม? ไม่บาป ไม่ใช่ว่าไม่บาปเพราะไม่ช่วยแม่ อย่ามองแบบนั้น,00.40.37,00.41.42
ใส่บาตรตอนเช้าแล้วไม่ได้กรวดน้ำเป็นอะไรหรือเปล่า,อยากจะบอกว่าการกรวดน้ำไม่ได้เป็นส่วนหนึ่งของการทําบุญเลย การกรวดน้ำเป็นเพียงแค่พิธีกรรมที่เราได้รับรู้รับทราบมา แล้วก็ไม่ได้ส่งผลต่อกิริยาแห่งการทําบุญว่ากรวดแล้วจะได้บุญหรือไม่ได้บุญ ไม่ได้เกี่ยว บุญมันสําเร็จในขณะที่เราได้ให้ทานเรียบร้อยแล้วและก็รวมทั้งที่เราใส่บาตรแล้ว โดยส่วนมากเราจะมีพระให้พร การให้พรก็ไม่ได้เป็นเครื่องหมายบอกว่าพระให้พรแล้วจึงจะได้บุญ เพราะว่าเราให้ทานพรอันประเสริฐก็สําเร็จในขณะที่เราได้ให้นั้นเสร็จเรียบร้อยแล้ว ไม่จําเป็นต้องขอพรกับท่านก็ได้ กระทั่งการขอพรและการกรวดน้ำไม่ได้เป็นตัวกําหนดส่วนบุญที่เรากระทํา,00.41.35,00.42.30
 ร่างกายไม่ใช่ของเรา จิตก็ไม่ใช่ของเราใช่ไหม แต่ทําไมจิตถึงตามเราไปทุกภพทุกชาติ ,ต้องอธิบายด้วยเหตุปัจจัย สืบเนื่องมาจากการที่เราไม่เคยได้เห็นว่ากายไม่ใช่เรา จิตไม่ใช่เรา คือในความหมายที่ว่าเราไม่เห็นคือไม่ได้เห็นด้วยปัญญาอันรู้แจ้งทางกายและไม่ได้เห็นด้วยปัญญาอันรู้แจ้งทางจิตว่าไม่ใช่เราอย่างไร แล้วความที่เราไม่ได้เห็นอันนี้นี่เองจึงก่อให้เกิดระบบของการสืบต่อ เพราะว่ากายกับจิตจะสืบต่อไปสู่ภพหรือข้ามภพข้ามชาติไปมีการเวียนว่ายตายเกิด เกิดแล้วเกิดอีก มันจะสืบเนื่องไป เพราะเรามีความเห็นในกายไม่ถูกต้องและมีความเห็นในจิตไม่ถูกต้อง เราอาจจะเรียนรู้และรับรู้มาว่ากายไม่ใช่เรา จิตไม่ใช่เรา แต่การรับรู้และเรียนรู้นั้น มันเป็นการรับรู้และเรียนรู้ผ่านการเข้าใจในส่วนของเราแต่ไม่ได้ทําให้จิตได้เข้าใจ ฉะนั้นเราเรียนรู้มาแล้วว่ากายไม่ใช่เรา จิตไม่ใช่เรา เราจะต้องเอาความรู้ส่งต่อเข้าไปในจิต ให้จิตมันได้เห็นแจ้งตามที่เราได้เรียนรู้มา ลําพังเพียงแค่การเรียนรู้ของเรา มันเป็นการเรียนรู้เพื่อจะลืม ฉะนั้นการเรียนรู้ใดๆก็ตามที่มันไม่ได้เข้าไปถึงจิตแน่นอน วันใดวันหนึ่งเราก็ต้องลืมเรื่องนั้น แล้วเมื่อเราลืมแล้ว กระบวนการท้องถิ่นซึ่งมันทําหน้าที่ในการสืบต่อภพชาติ มันก็จะดึงเอาความเห็นผิด คือจิตเองที่มันไม่ได้เห็นถูกต้องจากภายในเอง คือไม่ได้เกิดปัญญาแห่งความรู้แจ้งในกายในจิตจริงๆ มันจะไปดึงเอาการสืบต่อระบบกายระบบจิตก่อตัวในภพ แล้วสร้างภพใหม่อยู่เรื่อยๆให้กับเรา แล้วเอาอะไรเป็นตัวสร้างภพ? ก็เอากรรมที่เราทํา แล้วเป็นการทําด้วยอํานาจของอวิชชา ตัณหา อุปทาน กิเลส กรรมและวิบากทั้งหลาย มันจะดึงพวกนี้ไปเป็นเชื้อแห่งภพและนําก่อให้เกิดภพ ฉะนั้นพระองค์จึงตรัสไว้ว่าบุคคลใดก็ตามที่รู้แจ้งกายรู้แจ้งจิต การรู้แจ้งกายรู้แจ้งกิตจนความรู้แจ้งนั้นเชื่อมต่อกับพระนิพพาน เมื่อความรู้นั้นเชื่อมต่อกับพระนิพพาน จิตจะทําลายความเห็นผิดในกายในจิตได้อย่างถูกต้อง เมื่อจิตได้ทําลายความเห็นผิดในกายในจิตได้อย่างถูกต้อง จิตจะหยุดการสืบต่อภพชาติทั้งปวง ไม่มีการก่อตัวใหม่ในภพชาติ อวิชชาตัณหาอุปทานกิเลสกรรมวิบากก็ถูกทําลายไปพร้อมกับจิตชนิดนั้นๆ จิตก็จะเป็นจิตที่เหลืออยู่หลังจากนั้นเป็นจิตส่วนผล แต่จิตที่ยังเข้าไม่ถึงพระนิพพานจะเป็นจิตส่วนเหตุ คือสร้างเหตุแห่งการก่อเกิดอยู่ตลอดเวลา ส่วนจิตที่เหลืออยู่ของบุคคลผู้รู้แจ้งพระนิพพานแล้วเป็นจิตส่วนผล จิตส่วนผลก็คือจิตอันหนึ่ง แต่ไม่สร้างเหตุปัจจัยเพื่อนําไปสู่การเกิดในภพชาติอีก เมื่อละชีวิตและจิตสุดท้ายนั้นดับไปก็จะเข้าถึงกระแสพระนิพพาน แล้วก็ไม่เวียนว่ายตายเกิดอีก ,00.42.53,00.46.18
ในระดับของพระอนาคามี ท่านเห็นระดับไหน ท่านถึงไม่ได้ต้องการร่างกายอยู่แล้ว พระอนาคามีท่านตัดยังไง,ลักษณะของการละ จริงๆแล้วสังโยชน์ทั้งสิบ มันจะแบ่งเป็นสองทิฐิคือสองความเห็น แต่ความเห็นแรกคือสักกายทิฏฐิคือความเห็นผิดในการ ความเห็นที่สองคืออัตตานุทิฏฐิ ความเห็นผิดในจิต ก็คือเห็นผิดในส่วนกายกับส่วนจิต ความเห็นผิดในส่วนกาย มันถูกทําลายหมดสิ้นอยู่ในชั้นของพระอนาคามี เพราะว่าพระโสดาบันแม้ทําลายสักกายทิฏฐิได้ นั่นก็คือการทําลายสักกายทิฏฐิในชั้นของความเห็นผิดในตัวกาย แต่เพราะความที่อารมณ์ในกามราคะปฏิฆะที่สืบเนื่องกับกายยังมีอยู่ ก็ยังเรียกว่าเป็นส่วนของสักกายะอยู่ แต่ไม่ใช่สักกายทิฏฐิที่ติดของระดับพระโสดาบัน แต่เป็นสักกายทิฏฐิในชั้นของอารมณ์ อารมณ์ไม่ได้เกี่ยวกับความเห็นผิดในกาย แต่เป็นความเห็นผิดในอารมณ์ แต่อารมณ์เหล่านี้มันเกี่ยวเนื่องกับกามราคะปฏิฆะมันเกี่ยวเนื่องกับกาย จึงจัดอยู่ในส่วนสักกายทิฏฐิ สักกายทิฏฐิละได้หมดสิ้นก็คือจะมีส่วนของรูปกับน้ำนั่นเอง พระอนาคามีจึงยังมีความเห็นผิดในเรื่องของจิต คิดว่าจิตเป็นตน เขาเรียกว่าอัตตานุทิฏฐิ อัตตาคือตัวตน ทิฏฐิคือความเห็น เห็นว่าจิตเป็นตน เราจะสังเกตได้ว่าสังโยชน์ของพระอนาคามีที่เหลืออยู่ก็คือรูปราคะ อรูปราคะ มานะอุทธัจจะ อวิชชา อันนี้ก็คือส่วนของจิตล้วนๆ ไม่เกี่ยวเนื่องกับกายเลย เพราะฉะนั้นพระอรหันต์ทั้งหลายจึงสามารถทําลายความเห็นผิดในจิตว่าจิตไม่ใช่ตัวตน จิตไม่เป็นตนอย่างไร ท่านจะทราบได้ ฉะนั้นคนที่จะรู้แจ้งในจิตได้มีจําพวกเดียวคือพระอรหันต์,00.46.46,00.48.52
ถ้าเราให้เงินพ่อแม่แล้วแต่เราบ่นเรื่องการใช้เงินที่ดูฟุ่มเฟือยของท่าน อย่างนี้เราบาปไหม,ไม่บาป แต่มันจะไปตัดรอนผลของการให้ทานนั้นให้น้อยลง ไม่มีผลมาก ไม่มีอานิสงส์มาก,00.52.39,00.52.55
 คนที่รู้ว่าสิ่งนี้ทําแล้วไม่ดีต่อชีวิต เห็นว่าไม่ดีก็ยังทํา มีวิธีที่ทําให้จิตใจเข้มแข็งไหมที่จะไม่ทําต่อไป,เอาวิธีที่ดีที่สุดคือตั้งจิตให้เป็นกุศล ที่จิตเราคล้อยตามในเรื่องที่ไม่ดี แม้ทั้งที่รู้ว่ามันไม่ดีและก็ไม่อยากจะทําหรอก แต่มันก็เผลอใจไปทําอยู่เรื่อยๆก็แสดงว่าใจเรายังอ่อนแอต่อสิ่งที่เป็นอกุศล ฉะนั้นให้ตั้งจิตอยู่ในกุศลธรรมให้มากๆ สิ่งที่จะทําให้จิตเราเป็นกุศลได้ดีก็คือการระลึกถึงพระรัตนตรัยซึ่งเป็นมหากุศล ขอให้ระลึกถึงบทพระรัตนตรัย พุทโธเมนาโถ ธัมโมเมนาโถ สังคมเมนาโถ อย่างย้ำๆซ้ำๆอยู่ในจิตบ่อยๆ มันจะเกิดพลังดึงใจเราออกจากสิ่งที่เป็นอกุศล แล้วมันจะเกิดความเข้มแข็งในภายใน,00.55.04,00.55.54
