question,answer,start_time,end_time
ถ้าเราสวดพระมะริด เรายังห้อยของหลวงปู่ทวดอยู่ ถือว่าเป็นของขลังไหมคะ ต้องถอดไหม,วัตถุมงคลทุกชนิด ถือว่าเป็นของขลัง ที่เรามีจิตใจผูกติดหรือว่ายกคุณค่าของวัตถุนั้นให้สูงทางด้านจิตใจที่เราจะยึดพึ่ง แต่พระอาจารย์อยากจะบอกว่าสิ่งที่ชาวพุทธทั้งหลายควรยึดพึ่งก็คือพระรัตนตรัย ทีนี้เราอาจจะมองว่าหลวงปู่ทวดก็คือส่วนหนึ่งของพระรัตนตรัยคือเป็นสงฆ์สาวกของพระสัมมาสัมพุทธเจ้า พระอาจารย์อยากจะให้เข้าใจคําว่างฆ์สาวกของพระสัมมาสัมพุทธเจ้าในส่วนที่เป็นสาธารณะหรือว่าเป็นที่พึ่ง ส่วนที่เป็นสรณะ ที่พระองค์บอกว่าสังคังสะระณังคัจฉามิ คือการระลึกถึงสงฆ์สาวกของพระสัมมาสัมพุทธเจ้าก็คือ ระลึกถึงการปฏิบัติดีปฏิบัติชอบ ระลึกถึงข้อปฏิบัติดีปฏิบัติชอบ ระลึกถึงความบริสุทธิ์หมดจดแห่งจิตของบุคคลผู้ประพฤติตามหลักคําสอนของพระสัมมาสัมพุทธเจ้าจนสิ้นอัศวรรษกิเลส การระลึกถึงวงคุณเหล่านี้จึงเชื่อว่าเป็นสังคังสะระณังคัจฉามิคือเป็นสรณะที่พึ่งให้กับเรา ด้วยความที่สังคมไทยเรามีค่านิยมในเรื่องของการยึดถือเครื่องรางวัตถุปลุกเสกหรือของขลังนี้เป็นระยะเวลายาวนาน เราได้ดึงเอาคุณของพระอริยะทั้งหลายหรือคุณของพระสงฆ์ที่ท่านเก่งแล้วก็มีคุณงามความดีภายในองค์ท่านที่ท่านบําเพ็ญมาดึงเข้ามาไว้ในวัตถุเหล่านี้ การที่สังคมเราได้กําหนดการยึดถือหรือยึดพึ่งสิ่งเหล่านี้ให้กับชาวพุทธในสังคมมันก่อให้เกิดความอ่อนแอทางจิตใจ อย่างที่เราไม่รู้ตัวว่าจิตใจเรากําลังอ่อนแอ เพราะใจเราไม่สามารถพึ่งใจเราได้ ใจเราไปพึ่งอยู่กับวัตถุ เมื่อใจเราไม่สามารถพึ่งพาตัวเองได้ ความอ่อนแอมันจึงเกิดขึ้น แล้วความอ่อนแอเกิดขึ้นอย่างนี้ มันทําให้เรารู้สึกไม่มีความมั่นใจในตัวเอง เราจึงต้องมีพระเครื่องเหล่านี้ห้อยคอของเรา แล้วยิ่งเรามีไว้มากเท่าไร ใจเราก็ไม่สามารถที่จะพึ่งตัวเองได้ เพราะตามหลักคําสอนพระองค์ตรัสสอนให้เราพึ่งพาตนเอง การพึ่งพาตนเองนั้นจะต้องเป็นการพึ่งพาด้วยสติและปัญญาหรือความรู้ในทางด้านหลักคําสอนที่จะเป็นส่วนเสริมทําให้จิตของเราเกิดความเข้มแข็งในภายใน แล้วพระอาจารย์อยากจะบอกว่าค่านิยมทางสังคมหรืออิทธิพลที่ถูกสร้างไว้ หรือกระทําไว้ที่สืบเนื่องมา ยังไม่ถือว่าเป็นความสําคัญเท่ากับการที่จะน้อมจิตน้อมใจเราหรือว่าดึงจิตดึงใจเราให้อยู่กับพระรัตนตรัย พระอาจารย์อยากจะให้เราปฏิบัติไปถึงขั้นที่เรียกว่าฝากเป็นฝากตายไว้กับพระรัตนตรัยเลย จะเป็นจะตายก็ยึดถือพระรัตนตรัยนี่แหละไว้เป็นส่วนสําคัญภายในจิต แล้วคนที่เค้านําไปสู่การปฏิบัติ เค้าก็จะเห็นผลว่าจิตใจที่เกิดจากการระลึกถึงพระรัตนตรัยจิตใจเข้มแข็งขึ้น ดีขึ้น แล้วก็ดําเนินตามหลักแห่งการปฏิบัติในหลักคําสอนของพระพุทธเจ้ารู้สึกมันไปได้อย่างราบรื่นขึ้น ฉะนั้นพระอาจารย์อยากให้ตัดสินใจเอาเองว่าควรจะถอดหรือไม่ควรจะถอด ก็ควรจไตร่ตรองพิจารณาภายในใจตัวเรา ,00.57.14,01.00.49
อะไรเรียกว่าพึ่งเอง อะไรเรียกว่าพึ่งพระรัตนตรัย อย่างไร,เหมือนกับเราหิวข้าว มีอาหารมาวางไว้ต่อหน้าเรา เมื่ออาหารมาวางไว้ต่อหน้าเรา ถ้าเราจะให้อาหารนั้นวิ่งเข้าปากเองเนี่ยมันก็คงจะไม่ได้ เพราะฉะนั้นคือเมื่ออาหารมันอยู่ต่อหน้าเรา เราก็ควรจะพึ่งพาตัวเราเองนี่แหละที่จะ บริโภคอาหารนั้นด้วยตัวเอง นี่คือหลักความจริงก็คือว่าพระพุทธเจ้าพระองค์สอนหลักธรรมะไว้แล้ว สอนหลักสัจจะไว้แล้ว สอนหลักความจริงไว้แล้ว เราต้องขวนขวายในการที่จะแสวงหาหลักคําสอนนั้นน่ะเข้ามาสู่ภายในชีวิตเราแล้วยึดหลักคําสอนพึ่งพาคําสอนนั้นไปตลอดทั้งชีวิต,01.02.18,01.03.08
ช่วยแนะนําวิธีการฝึกสติเบื้องต้นให้หน่อย,ฝึกสติเบื้องต้น ที่เบื้องต้นที่สุดก็คือการระลึกถึงพระรัตนตรัย ขอให้พวกเราเข้าใจว่าชาวพุทธทั้งหมดในประเทศไทย การระลึกถึงพระอนาคตนี่แหละคือสติ เพราะสติคือการระลึก ถ้าเราได้ยินสติในที่ไหนก็ตามขอให้เข้าใจว่าคือการระลึก ระลึกถึงสิ่งที่เป็นกุศล อะไรคือสิ่งที่เป็นกุศล เบื้องต้นเลยก็คือพระพุทธ พระธรรม พระสงฆ์เป็นมหากุศลด้วย พุทโธเมนาโถเป็นพุทธานุสติ ธรรมาเมนาโถเป็นธรรมานุสติ สังโฆเมนาโถเป็นสังฆานุสติ ถ้าเราฝึกระลึกอยู่บ่อยๆ ฐานของสติแบบเบื้องต้นจะถูกสร้างขึ้นภายในจิตใจเรา เมื่อจิตใจเราระลึกถึงสิ่งที่เป็นกุศลได้บ่อยๆ มันก็จะไม่ค่อยนึกถึงสิ่งที่เป็นอกุศล เมื่อมันไม่นึกถึงสิ่งที่เป็นอกุศล สิ่งที่เป็นมหากุศลคือพระรัตนตรัยก็จะเกิดคุณค่ารองรับจิตใจเราเป็นบาตรเบื้องต้น แล้วเราจะนึกถึงคุณงามความดีหรือบทกรรมฐานหรือเจริญสติในแง่อื่นๆ ในด้านกายเวทนาจิตธรรม มันก็จะเจริญไปได้ง่ายเพราะสิ่งที่ทําให้เราเจริญสติได้ยากก็คือจิตใจเรามันไปข้องแวะอยู่กับสิ่งที่เป็นอกุศล นึกถึงสิ่งที่เป็นอกุศลโดยส่วนมาก ฉะนั้นถ้าเราฝึกในการระลึกถึงพระรัตนตรัย จิตเราก็จะคุ้นเคยและเกาะเกี่ยวอยู่กับพระรัตนตรัยที่เป็นกุศลแล้วทําให้เราตั้งสติอยู่กับกายเวทนาจิตฑรรมได้ดี เบื้องต้นก็แนะนํานี้แหละ ,01.03.13,01.04.49
ชอบดูซีรีส์ประวัติศาสตร์จีนมาก ตอนเริ่มปฏิบัติจากพระอาจารย์ก็ดูอยู่ บางทีดูมากกว่าปฏิบัติซะอีก และมีอยู่วันนี้เพื่อดูซีรีส์ไปทํางานไป ปรากฏว่ามีความคิดหนึ่งเข้ามาว่าดูซีรีส์ทําไม ดูก็มีแต่อิจฉาริษยาชิงดีชิงเด่นกัน ไม่เห็นมีปัญญาอะไรเลย ก็ปิดซีรีย์ทันที มาเปิดฟังธรรมของพระอาจารย์ คําถามหายไป อาจจะเป็นการรายงานผลให้ฟัง พระอาจารย์อยากจะเสริมอะไรหรือไม่อย่างไร,ก็ดีในแง่นี้ แต่พระอาจารย์ไม่ได้ห้ามนะเพราะว่าธาระของฆราวาสย่อมมีความเกี่ยวข้องกับสิ่งเหล่านี้อยู่แล้ว เมื่อมีความเกี่ยวข้องก็ไม่ได้ถึงกับเป็นขั้นที่ต้องกําหนดตายตัวว่าการปฏิบัติจะต้องอยู่กับข้อปฏิบัติล้วนๆเลย ไม่ได้เกี่ยวข้องกับการดูการชมในแง่ของบันเทิงอะไรอย่างนี้ไม่มีข้อกําหนดในบุคคลผู้เป็นฆราวาส แต่พระภิกษุเนี้ยมีข้อกําหนดไว้แล้ว อันนี้คือสถานะพระภิกษุ ฉะนั้นพระองค์บอกว่าปฏิบัติธรรมสมควรแก่ธรรมนั้นดีที่สุด, 01.05.01,01.06.36
การที่ระลึกถึงระลึกถึงพระรัตนตรัยซ้ำๆเป็นประจําในขณะที่ขับรถ เผลอฮัมเพลงในใจ แต่จู่ๆก็ระลึกถึงพระรัตนตรัยก็เด้งเข้ามาในหัวเรา แบบที่ไม่ได้เจตนาจะนึกถึง ลักษณะนี้หมายถึงอะไร และควรทําอย่างไรต่อ,พระอาจารย์อยากจะอธิบายให้เข้าใจว่า เมื่อใดก็ตามที่เราได้ระลึกถึงพระรัตนตรัยย้ำๆซ้ำๆอยู่เป็นประจํา มันจะเกิดกลไกลอันหนึ่งในระบบจิตเขาเรียกว่าสิ่งที่อยู่เหนือเจตนา ในเมื่อสิ่งที่อยู่เหนือเจตนา มันสามารถทํางานอยู่บนพื้นฐานจิตปกติในคราวที่ผิดปกตินี้อ่อนเจตนาหรือเจตนามันอ่อนลง ระบบของสิ่งที่อยู่เหนือเจตนาจะเกิดขึ้นมาเองโดยอัตโนมัติ พระอาจารย์จึงอยากจะบอกว่าที่เราระลึกถึงผ้าไตรย้ำๆซ้ำๆอันนี้ก็คือเป็นการฝึกสติในเป็นพื้นฐานเบื้องต้นที่เคยกล่าวมาก่อนหน้านี้ ฉะนั้นเวลาจิตของเราเผลอไปร้องเพลง คําว่าเผลอที่เป็นเผลอไปร้องเพลง ตัวสติที่เราเคยฝึกระลึกอยู่กับรัตนตรัยที่มันเริ่ม จะสามารถอยู่เหนือเจตนาได้แล้ว อย่างที่พระอาจารย์เคยอธิบายว่าสิ่งที่อยู่เหนือเจตนากับสิ่งที่อยู่เหนือเจตนามันจะแก้กันเอง การที่เผลอไปฮัมเพลงในใจก็คือสิ่งที่เหลือเจตนาส่วนหนึ่ง พระรัตนตรัยที่เราท่องหรือระลึกอยู่เป็นประจําก็เป็นสิ่งที่อยู่ในเจตนา ฉะนั้นสองอย่างนี้มันจะมีอยู่ในภาวะของการแก้กันอยู่ มันจะเกิดการรู้สึกตัวว่าร้องเพลงแล้วนะ มันก็จะรีบเข้ามาแล้วนึกถึงบทพระรัตนตรัย ทําให้เจตนาปัจจุบันไปต่อกับพระรัตนตรัยนั้นได้ วิธีการอย่างนี้ทําไว้เป็นประจําให้มันเป็นคุณสมบัติของจิตและเมื่อใดก็ตามที่จิตเกิดคุณสมบัติลักษณะนี้ขึ้น โอกาสในการที่จะเข้าไปถึงกระแสอริยมรรคในการทําลายอัศวะจะเป็นไปได้ดีและเป็นไปได้อย่างสูง แล้วก็ไปได้เร็วมากกว่าคนอื่น ให้ฝึกระลึกถึงพระไตรปิฎกอย่างนี้ต่อไป ถ้าสามารถขยับมาท่องท่ากรรมฐานสี่ได้ก็ขยับเข้ามาท่องท่าสี่ได้เลย ,01.06.44,01.09.11
ทําสมถกรรมฐานระยะหนึ่งแล้ว เมื่อมีเหตุกระทบแล้วรู้สึกตัวได้ แต่เหมือนโทสะเข้มข้นรุนแรงกว่าเดิม ผิดปกติหรือไม่ ขอคําแนะนํา,โทสะเกิดขึ้นมันไม่ได้ผิดและไม่ใช่ความผิดปกติของการปฏิบัติ เนื่องจากว่าจิตของเราเป็นที่สะสมของอารมณ์และเมื่ออารมณ์ที่อยู่ในจิต เวลามันถูกปฏิบัติแล้วจะไปดึงเอาเรื่องราวที่ถูกสะสมนั้นชําระล้างออกมาหรือคลายตัวออกมา ในขณะที่มันปรากฏออกมานั้น ขอให้เราเข้าใจว่าการปฏิบัติของเราเองนี่แหละที่ไปดึงเอาอารมณ์ที่มันหมักหมมอยู่ในภายในหรือกลุ่มอาศวะทั้งหลายได้ถูกแก้ไขหรือถูกนํามาสู่การชําระล้าง คําว่าชําระล้างคือชําระล้างที่ความเห็นผิดที่เรามีความเห็นต่ออารมณ์ในจิตว่าแต่จิตเรามีโทสะ จริงๆแล้วจิตเราไม่ได้มีโทสะ คือจิตกับโทสะไม่ใช่อันเดียวกัน จิตคือจิต โทสะคือโทสะ เพียงแต่ว่าจิตกับโทสะ มันเป็นอารมณ์ จิตที่มันรับอารมณ์เกาะเกี่ยวกันอยู่โดยที่ไม่ได้ไปถูกแก้ไข บัดนี้อารมณ์เหล่านั้นจะถูกชําระล้างออกจากจิตก็ปล่อยให้โทสะนั้นปรากฏและแสดงออกมา แต่อย่าหลงไปกระทําต่อต่อโทสะหรืออย่าไปรู้สึกวุ่นวายกับอาการแห่งโทสะ ก็ปล่อยให้โทสะนั้นปรากฏแล้วก็คลายไป ปรากฏแล้วก็ถ่ายไป แล้วก็เข้าใจสภาพการณ์ของอารมณ์ที่อยู่ในจิตนั้นว่ามันเป็นคนละส่วนกับจิต จิตไม่ใช่อารมณ์ อารมณ์ก็ไม่ใช่จิต อารมณ์มาแล้วก็ไป แต่จิตยังเป็นที่ตั้งแห่งการรับอารมณ์อย่างอื่นได้อีก ให้เข้าใจว่ามันถูกต้องตามเหตุปัจจัยแล้ว, 01.09.20,01.11.07
เวลาเรานั่งสมาธิปวดหลัง ปวดเมื่อย เราควรนั่งต่อหรือพิจารณากาย,ไม่ควรที่จะนั่งต่อ เพราะว่าเวทนาจะรบกวนการนั่ง ไม่สามารถทําให้เรานั่งต่อไปได้ แล้วถ้าเราฝืนนั่งต่อไปจะทําให้เรารู้สึกเบื่อหน่ายต่อการนั่ง ฉะนั้นอยากให้แนะนําให้เดินจงกรมในการพิจารณาร่างกายจะดีกว่าและมีประโยชน์,01.11.11,01.11.35
