question,answer,start_time,end_time
มีธรรมะในข้อใดที่พระพุทธองค์ได้เคยสอนคนที่ทําการค้า คนที่ทําธุรกิจ คนที่ครองเรือน ท่านได้มีธรรมะอะไรที่สอนให้เขาเจริญงอกงามในหน้าที่การงานที่เขาทํา มีบ้างไหมคะ,"ธรรมะในเรื่องนี้ พระพุทธองค์ตรัสไว้เยอะพอสมควร แล้วก็รายละเอียดในพระไตรปิฎกน่าจะเรียกว่า คือสามารถเป็นแบบแผนทางด้านทําการค้าขายเลยก็ว่าได้ คือจะเรียกว่านักการตลาดก็ว่าได้ พุทธองค์เข้าใจหลักการใช้ชีวิต เข้าใจเหตุปัจจัยที่จะทำให้บุคคลผู้นั้นเข้าถึงความเจริญด้วยเหตุแห่งการกระทําและพระองค์เป็นผู้เน้นหนักเรื่อง การสร้างเหตุแห่งการกระทํานี้เอง จึงทําให้พระองค์ได้บัญญัติหลักในการดําเนินชีวิตสําหรับชาวบ้าน และก็ทราบดีว่าชาวบ้านเองก็ยุ่งเกี่ยวอยู่การงาน พระองค์ก็ทราบด้วยว่าเหตุปัจจัยของการงานที่จะนําไปสู่ความเจริญของผู้คนนั้น ควรจะสร้างเหตุปัจจัยอย่างไร และในหลักธรรมที่มีรายละเอียดมาก หลักๆก็ที่เราอาจจะเคยได้ยินใช่ไหมว่า หัวใจเศรษฐีก็คือ อุอากะสะ ที่เราเคยได้ยินกัน นํามาถูกบอกสอนบ่อยครั้งมาก ถือว่าเป็นหัวใจของการทําการค้าขายหรือว่าการใช้ชีวิตตัวเองหรือทําให้ตัวเอง ดําเนินตัวเองอยู่ในหลักการการทําการงานในวิถีชีวิตที่เราจะต้องดํารงชีพอย่างไรจึงจะเหมาะจะควร หัวใจเศรษฐีที่พวกเราชาวพุทธคุ้นเคยกันอย่างมาก ไม่ใช่ให้เอาไปท่อง ไม่ใช่ท่องเพื่อให้เกิดความร่ํารวยเป็นเศรษฐีอะไร แต่มันหลักของการปฏิบัติ ต้องเข้าใจว่าพระพุทธเจ้าสอนอะไรก็ตาม สิ่งที่พระองค์ทรงสอน ต้องนําไปสู่การปฏิบัติถึงจะเกิดผล พระองค์จึงได้ชื่อว่าเป็น กัมมวาทีคือว่าบุคคลผู้มีวาทะคือกล่าวเรื่องการกระทําเป็นความสําคัญ การรอผลดลบัน อันนั้นเป็นหลักการที่พระองค์ไม่สรรเสริญแล้วก็ไม่เคยสอนให้เราไปกระทํากันอย่างงั้น แล้วก็ชี้ให้เห็นด้วยว่าเป็นความงมงายอย่างหนึ่งในชีวิต คําว่าอุอากะสะก็คือ อุ มาจากคําว่า อุทานสัมปทาน เราถึงพร้อมด้วยความขยันหมั่นเพียร ขยันหา หรือว่าขยันในการที่จะแสวงหาในการงานที่จะนํามาซึ่งทรัพย์สมบัติ รู้จักช่องทาง รู้จักโอกาส รู้จักการที่จะทําสิ่งนั้นให้จริงจริงจังจังให้ถึงที่สุด ไม่เข็นแก่เหน็ดเหนื่อยหรือเหนื่อยยากในการกระทํา พระองค์ใช้คําว่าอาบเหงื่อต่างน้ำในการกระทําในสิ่งเหล่านั้นและอุทานสัมปทาน แล้วก็ถึงพร้อมด้วยความขยันหมั่นเขียร ถ้าเกิดเราจะดูตามศัพท์ เราอุฏฐานะ คือการหมั่นที่จะลุกขึ้นอยู่บ่อยๆ ถ้าขี้เกียจคือขยับร่างกายอย่าอยู่นิ่งๆอะไรประมาณนี้ แต่ทีนี้บางทีการงานในเวลานี้ มันเป็นการงานที่อยู่ในโลกออนไลน์เสียส่วนมาก คําว่าอุฏฐานสัมปทาก็คือการใส่ใจไม่ทอดธุระในการงานนั้นอยู่เสมอ,สอง อารักขสัมปทาก็คือ เมื่อได้ทรัพย์มาแล้วหมั่นรักษาทรัพย์นั้นไม่ให้ไปใช้จ่ายในทาง สูญเสียโดยเปล่าประโยชน์ คือเก็บไว้ลงทุน การที่พระองค์ตรัสเรื่องการใช้ทรัพย์ พระองค์ก็บอกว่าเมื่อได้ทรัพย์มาแล้ว ส่วนหนึ่งให้เก็บไว้ลงทุนก่อน อย่าเพิ่งเอาไปใช้จ่าย ขอให้หักไว้ลงทุนก่อน เหลือจากการลงทุนนั้น เราก็เลือก หนึ่งตอบแทนคุณมารดาบิดาเรียกว่าใช้หนี้เก่า,สองก็ใช้กับตัวเอง เรียกว่าทิ้งลงเหวก็คือเอามาเลี้ยงชีพตนเอง,สาม ก็คือการให้กู้ยืมคือเขาเรียกว่าให้คนอื่นกู้ยืม อันที่สี่ก็คือทําบุญ อันนี้คือนอกเหนือจากการที่เก็บไว้ลงทุนแล้ว แต่ถ้าไม่เหลือจากการเก็บไว้ลงทุนนี้ต้องรักษาทุนทรัพย์เพื่อการลงทุนนี้ไว้ก่อน กัลยาณมิตตตา เขาเรียกว่าคบเพื่อนที่ดี เพราะว่าการคบเพื่อน บางครั้งเพื่อนบางคนไม่ได้มองเห็นประโยชน์กับเรา ผลาญประโยชน์จากทรัพย์ของเราก็มี
เพื่อนที่ดีที่สุดก็คือเพื่อนที่รักษาประโยชน์จากทรัพย์และการงานที่เราทํา คือเห็นแก่ทรัพย์ เห็นแก่ประโยชน์ของเราโดยที่ไม่ทําให้ทรัพย์และประโยชน์ในการงานของเราได้เสียหายไป มีแต่คอยสนับสนุนส่งเสริมให้เราได้สําเร็จในหน้าที่การงานอันนั้น ถ้าเพื่อนที่ดีต้องเป็นอย่างนี้เรียกว่ากัลยาณมิตร ประเภทที่เรียกว่ายืมเงินแล้วไม่ยอมคืน แล้วก็ประเภทที่ คอย เซาะ เบะ ขอ ยืมนิดๆหน่อยๆ คือบางทีมันบ่อยครั้งๆ ทําให้ทรัพย์เราไม่เพิ่มพูนหรือทรัพย์เราเสียหาย หรือว่าเพื่อนชักชวนไปในทางอบายมุข ไปในทางการดื่มสุราที่เราทําให้เสียทรัพย์ ไม่ได้นํามาซึ่งประโยชน์แก่ทรัพย์นั้น เพื่อนประเภทนี้พระองค์บอกว่า เราต้องมองให้ออกแล้วก็เลือกในการที่จะคบ เพราะไม่งั้นมันส่งผลต่อหน้าที่การงานและส่งผลต่อความเป็นอยู่ของชีวิตเราด้วย นี้คือเรียกว่ากัลยาณมิตร อันที่สี่สมชีวิตา ใช้ชีวิตให้เสมอกับทรัพย์ที่แสวงหามาได้ อย่าใช้จ่ายเกินกว่าทรัพย์ที่ตัวเองมีอยู่ คือไม่ฟุ่มเฟือยมาก เอาพอเลี้ยงชีพ พอเลี้ยงตัวให้เสมอกับที่ตัวเองได้มา ได้มากใช้มาก ได้น้อยใช้น้อย แต่พอควร ฉะนั้นในหลักการนี้ก็คือเป็นหลักการที่พระองค์วางไว้สำหรับบุคคลผู้ปรารถนาประโยชน์สําเร็จในหน้าที่การงานและนํามาซึ่งโชคทรัพย์สมบัติที่ตัวเองจะได้รับประโยชน์อันนี้ที่เรียกว่าเป็นที่จะทําให้กระทําประโยชน์หรือประโยชน์ในปัจจุบันนี้ที่เราจะได้รับ ก็เลยมีภาษาหรือคํากล่าวที่เป็นคําบัวหาร ให้เราได้จําง่ายก็คือว่าอันแรกก็คืออุฏฐานสัมปทาเรียกว่าขยันหา อารักขะสัมปทาเรียกว่ารักษาไว้ดี กัลยาณมิตตตาคือมีเพื่อนที่ดี สมชีวิตาใช้ชีวิตให้เสมอ สมควรแก่ทรัพย์ที่ได้มา เขาเรียกว่า ขยันหา รักษาดี มีเพื่อนที่ชอบ เพื่อนที่ทางดี แล้วก็ใช้ชีวิตให้เหมาะสม เหมาะสมกับฐานะของตัวเอง",00.01.45,00.09.19
ชอบคิดมากเรื่องชาวบ้านทําไงดี,ชอบคิดมากเรื่องชาวบ้าน เราก็มาดูความคิดที่เรากําลังคิดออกนอกไปจากเรื่องราวของตัวเรา ว่าจิตเรากําลังมีความคิด ความคิดกําลังเกิดขึ้นกับจิต จิตกําลังถูกความคิด ลักษณะนี้ปรุงแต่งอยู่ ความคิดลักษณะนี้กําลังปรุงแต่งจิตเราอยู่ การรู้เท่าทันจิต จะทําให้จิตที่มันถูกรู้อยู่ ไม่เข้าไปดึงเอาเรื่องของคนอื่นมาเป็นปัญหาอยู่ภายในใจของตนเอง การคิดเรื่องชาวบ้าน ไม่ได้หมายถึงว่ามันจะผิด แต่ถ้าหากเราคิดในทางประโยชน์เกื้อกูล คิดในทางสร้างสรรค์ คิดในการที่จะช่วยเหลือกัน มันก็เป็นความคิดที่ดี แต่ถ้าหากเรามองว่าความคิดที่เราไปคิดเรื่องของชาวบ้าน มันเป็นความคิดที่อยากจะไปรู้เรื่องของเขา ประเภทสอดรู้สอดเห็น มันก็เป็นสิ่งที่ไม่ดี ก็ไม่ควร ไม่เหมาะในการที่จะไปคิดอย่างนั้น สังคมเราไม่ได้หมายถึงว่าจะไม่ให้คิดเรื่องของบุคคลที่เราเกี่ยวข้อง สังคมเราไม่ได้บอกว่าจะต้องไม่แยแสหรือไม่สนใจกับสิ่งรอบข้าง แต่พระองค์สอนให้พวกเราสนใจและก็เข้าใจในสิ่งที่เราเกี่ยวข้องอยู่ สังคมรอบข้างจะดี มันก็ส่งผลต่อเราด้วย สังคมรอบข้างจะไม่ดี ก็ส่งผลกับเราด้วยในทางที่ไม่ดี ฉะนั้นให้เรามองหรือเกี่ยวข้องกับเรื่องของชาวบ้านในมูลเหตุปัจจัยที่เป็นไปเพื่อประโยชน์และสร้างสรรค์จะดีที่สุด ,00.10.21,00.11.55
อายุสิบแปด เป้าหมายสูงสุดคือไม่อยากกลับมาเกิดอีก  แต่ไม่ทราบว่าจะเริ่มอย่างไร,อันนี้พระอาจารย์ได้เคยบอกแนวทางอย่างชัดเจนไว้แล้วนะคะ หรืออย่างน้อยลองไปเสิร์ชนะคะ แนวทางการปฏิบัติสู่โสดาบัน คํานี้เลยนะคะ ลองเสิร์ชในยูทูป พระอาจารย์บอกแนวทางเป็นขั้นเป็นตอนไว้อย่างชัดเจน,00.12.00,00.12.20
เวลาใส่บาตรถ้าเราทําอาหารใส่เอง แล้วเราชิมตอนปรุงได้ไหม จะผิดไหม,ในขณะที่ทําอาหารให้ตั้งใจไว้ว่าเราจะทําอาหารเพื่อเรา พอทําอาหารเสร็จแล้วค่อยแบ่งอาหารของเราไปทําบุญ ให้ทําอย่างงี้ ถ้าเราตั้งใจว่าจะทําอาหารเพื่อใส่บาตร อาหารนั้นจะน้อมใจไปเพื่อเป็นของสงฆ์ ถ้าเราไปชิมก็คือได้มีโทษ แต่มันก็ไม่ได้โทษมาก เป็นโทษอ่อนๆที่จะเกิดขึ้น แต่ทางที่ดีที่สุดก็คืออย่างที่พระอาจารย์บอกก็คือให้ทําอาหารนั้นเพื่อตนก่อน แล้วแบ่งส่วนของตนไปทําบุญจะได้บุญมากกว่า,00.12.30,00.13.10
เพิ่งเริ่มนั่งสมาธิได้สองสามวัน แต่เมื่อวานขณะที่นั่งอยู่หนิงรู้สึกถึงตัวลอยๆ แล้วเห็นเหมือนวงกลมสีรุ้ง ถือว่าปกติมั้ย,การนั่งสมาธินี้เป็นภาวะปกติของบุคคลผู้นั่งทั่วไปที่จะต้องเกิดนิมิตปรากฏให้ทราบภายในสมาธินั้น คือเรียกว่าเริ่มมีสมาธิจิตอ่อนๆขึ้นมา เป็นสมาธิที่จะกําลังรวมตัวกันก็จะปรากฏเป็นลักษณะอย่างนี้ พระอาจารย์ก็อยากจะให้แนะนําให้ไปดูการวิธีการนั่งสมาธิ เพื่อรองรับสติแบบที่พระอาจารย์สอน เพราะว่าบางคนในขณะที่นั่งสมาธิ ถ้าขาดสติหรือไม่มีสติในขณะที่นั่ง เวลาเจอนิมิตบางอย่างปรากฏขึ้นมา อาจจะตั้งสติไม่ทัน หากนิมิตนั้นเป็นนิมิตในทางด้านของความหวาดกลัว อาจจะส่งผลต่อสภาพจิตใจในขณะที่นั่งได้ด้วย จึงอยากจะให้ไปฝึกสมาธิแบบรองรับสติไว้ก่อน,00.14.00,00.15.01
